Title,SKU,Sale_Price,Regular_Price,Availability,Link,Date
Green Tara (Dolma) Statue: The Buddhist Goddess of Compassion,GTAO 922,$516.00,$645.00,Available,https://nidhiratna.com/products/green-tara-dolma-statue-the-buddhist-statue,06/01/2025
Add Tranquility to Your Home with a Green Tara Statue,GTAO 923,$516.00,$645.00,Available,https://nidhiratna.com/products/add-tranquility-to-your-home,06/01/2025
Crowned Amitayus Buddha Statue for Health and Long Life Blessings,ATAO 921,"$9,600.00","$12,000.00",Available,https://nidhiratna.com/products/crowned-amitayus-buddha-statue-for-health,06/01/2025
Bring Home the Blessings of a Mother Green Tara,GTDD 920,,,Sold Out,https://nidhiratna.com/products/bring-home-the-blessings-of-a-mother,06/01/2025
Invite Guru Padmasambhava Statue for Exquisite Blessings,GRAO 925,$516.00,$645.00,Available,https://nidhiratna.com/products/invite-guru-padmasambhava,06/01/2025
Amitayus Statue: A Blessing for Longevity and Prosperity in Gold,ATDS 928,"$1,344.00","$1,680.00",Available,https://nidhiratna.com/products/amitayus-statue-a-blessing-for-longevity,06/01/2025
Handcrafted White Tara: Perfect for Meditation and Spiritual Growth,WTDS 929,"$1,344.00","$1,680.00",Available,https://nidhiratna.com/products/handcrafted-white-tara-perfect-for-meditation,06/01/2025
Handcrafted Manjushri Bodhisattva Statue for Spiritual Awakening,MSDS 930,"$1,344.00","$1,680.00",Available,https://nidhiratna.com/products/handcrafted-manjushri-bodhisattva-statue,06/01/2025
The Bodhisattva of Compassion and Mercy: Chenrezig Statue,CHDS 931,"$1,344.00","$1,680.00",Available,https://nidhiratna.com/products/the-bodhisattva-of-compassion-and-mercy-chenrezig-statue,06/01/2025
Embodying the Wheel of Time and Cosmic Order: Kala Chakra Statue,KCDC 933,"$1,316.00","$1,645.00",Available,https://nidhiratna.com/products/embodying-the-wheel-of-time-and-cosmic-order-kala-chakra-statue,06/01/2025
Fierce Palden Lhamo with Fiery Backdrop,PLDC 932,$916.00,"$1,145.00",Available,https://nidhiratna.com/products/fierce-palden-lhamo-with-fiery-backdrop,06/01/2025
Buddhist Padmasambhava Statue for Cultivating Inner Peace,GRAO 924,$516.00,$645.00,Available,https://nidhiratna.com/products/buddhist-padmasambhava-statue-cultivating-inner,06/01/2025
Intricate Half Oxidized Silver Shakyamuni Buddha Statue,BSAO 934,"$1,178.40","$1,473.00",Available,https://nidhiratna.com/products/intricate-half-oxidized-silver-shakyamuni-buddha-statue,06/01/2025
Unique Oxidized Silver Amitayus Statue,ATAO 935,$764.00,$955.00,Available,https://nidhiratna.com/products/unique-oxidized-silver-amitayus-statue,06/01/2025
Buddhist Guru Lotus Statue: Symbol of Compassion and Clarity,GRAO 926,$516.00,$645.00,Available,https://nidhiratna.com/products/buddhist-guru-lotus-statue-padma,06/01/2025
Elegant Guru Lotus Statue: Inspire Your Journey to Enlightenment,GRAO 927,"$1,084.00","$1,355.00",Available,https://nidhiratna.com/products/elegant-guru-lotus-statue-inspire,06/01/2025
Artistic Oxidized Shakyamuni Buddha Statue With Fine Details,BSDD 936,"$1,400.00","$1,750.00",Available,https://nidhiratna.com/products/artistic-oxidized-shakyamuni-buddha-statue,06/01/2025
Chenrezig Statue for Health & Wellness: Compassionate Healing,CHDB 885,$924.00,"$1,155.00",Available,https://nidhiratna.com/products/chenrezig-statue-for-health-wellness-compassionate,06/01/2025
Stunning Red Buddha: A Unique Representation of Compassion and Courage,BSDD 837,$960.00,"$1,200.00",Available,https://nidhiratna.com/products/stunning-red-buddha-a-unique-representation,06/01/2025
Dorje Sempa Statue in Gleaming Gold: Guardian of Spiritual Transformation,VSDD 937,"$1,320.00","$1,650.00",Available,https://nidhiratna.com/products/dorje-sempa-statue-in-gleaming-gold-guardian,06/01/2025
Discover the Healing Power of the Amitayus Statue,ATDD 938,"$1,320.00","$1,650.00",Available,https://nidhiratna.com/products/discover-the-healing-power-of-the-amitayus-statue,06/01/2025
Empowering Dolma Buddha Statue: A Guardian for Your Journey,GTAO 941,"$1,940.00","$2,425.00",Available,https://nidhiratna.com/products/empowering-dolma-buddha-statue,06/01/2025
Empowering Vajrapani Buddha Statue for Mindfulness and Focus,VPAO 943,"$1,040.00","$1,300.00",Available,https://nidhiratna.com/products/empowering-vajrapani-buddha-statue,06/01/2025
Fostering Compassion: The Chenrezig Buddha Statue for Your Altar,CHAO 942,"$3,036.00","$3,795.00",Available,https://nidhiratna.com/products/fostering-compassion-the-chenrezig,06/01/2025
Green Tara (Tara Devi) Sculpture: Invoke Divine Compassion,GTAO 944,"$1,248.00","$1,560.00",Available,https://nidhiratna.com/products/green-tara-tara-devi-sculpture,06/01/2025
Guardian of Dharma with Weapons and Fire Aura: Six Arm Mahakala,SAMAO 849,"$1,040.00","$1,300.00",Available,https://nidhiratna.com/products/guardian-of-dharma-with-weapons-and-fire-aura-six-arm-mahakala,06/01/2025
Sacred Full Silver Namtoshe Statue,NTAO 917,"$3,368.00","$4,210.00",Available,https://nidhiratna.com/products/sacred-full-silver-namtoshe-statue,06/01/2025
Fully Oxidized Design for Spiritual Strength: Troma Nagmo Statue,TNMP 749,$360.00,$450.00,Available,https://nidhiratna.com/products/fully-oxidized-design-for-spiritual-strength-troma-nagmo-statue,06/01/2025
Majestic 1000-Armed Avalokiteshvara Sculpture for Spiritual Protection,CHDS 940,,,Sold Out,https://nidhiratna.com/products/majestic-1000-armed-avalokiteshvara-sculpture,06/01/2025
Fearsome Mahakala on Garuda: Protect Your Space with Divine Power,GMDC 945,"$1,040.00","$1,300.00",Available,https://nidhiratna.com/products/fearsome-mahakala-on-garuda-protect,06/01/2025
Vajrapani Bodhisattva Sculpture: Symbol of Unyielding Strength,VPDC 946,$904.00,"$1,130.00",Available,https://nidhiratna.com/products/vajrapani-bodhisattva-sculpture-symbol,06/01/2025
Wrathful Vajradhaka Sculpture: Symbol of Purification & Enlightenment,VDDC 947,,,Sold Out,https://nidhiratna.com/products/wrathful-vajradhaka-sculpture-symbol,06/01/2025
Authentic Oxidized Shakyamuni Buddha,BSA 948,"$1,020.00","$1,275.00",Available,https://nidhiratna.com/products/authentic-oxidized-shakyamuni-buddha,06/01/2025
Oxidized Milarepa Figure: The Perfect Addition to Your Sacred Space,MA 949,,,Sold Out,https://nidhiratna.com/products/oxidized-milarepa-figure-the-perfect-addition,06/01/2025
Timeless Marpha Statue: Inspiring the Path to Enlightenment,MPA 950,,,Sold Out,https://nidhiratna.com/products/timeless-marpha-statue-inspiring,06/01/2025
Unique Oxidized Gampopa Statue: Guardian of the Kagyu Tradition,GA 951,,,Sold Out,https://nidhiratna.com/products/unique-oxidized-gampopa-statue-guardian,06/01/2025
"The Kagyu Lineage Masters Set: Marpha, Milarepa, and Gampopa Statues",MMGA 954,,,Sold Out,https://nidhiratna.com/products/the-kagyu-lineage-masters-set,06/01/2025
Unique Spiritual Decor for Mindfulness: Shakyamuni Buddha Statue,BSA 952,"$1,000.00","$1,250.00",Available,https://nidhiratna.com/products/unique-spiritual-decor-for-mindfulness-shakyamuni-buddha-statue,06/01/2025
Oxidized Healing Buddha: Symbol of Spiritual and Physical Healing,MBA 953,$904.00,"$1,130.00",Available,https://nidhiratna.com/products/oxidized-healing-buddha-symbol-of-spiritual,06/01/2025
Primordial Wisdom in Art: Oxidized Samantabhadra with Consort,SBCDD 955,,,Sold Out,https://nidhiratna.com/products/primordial-wisdom-in-art-oxidized,06/01/2025
Oxidized Shakyamuni Buddha Statue | Himalayan Buddhist Statue,BSDD 960,"$1,120.00","$1,400.00",Available,https://nidhiratna.com/products/oxidized-shakyamuni-buddha-statue-himalayan-buddhist-statue,06/01/2025
Discover Peace and Enlightenment with This Oxidized Shakyamuni Buddha,BSDD 959,"$1,120.00","$1,400.00",Available,https://nidhiratna.com/products/discover-peace-and-enlightenment,06/01/2025
Handcrafted Oxidized Siddhartha Sculpture: A Symbol of Inner Calm,BSDD 956,"$1,160.00","$1,450.00",Available,https://nidhiratna.com/products/handcrafted-oxidized-siddhartha-sculpture,06/01/2025
Oxidized Shakyamuni Buddha Statue  A Spiritual Touch for Your Home Decor,BSDD 957,,,Sold Out,https://nidhiratna.com/products/oxidized-shakyamuni-buddha-statue-a-spiritual-touch,06/01/2025
Buddha Figurine: Bring Tranquility & Mindfulness to Your Space,BSDD 958,$957.60,"$1,197.00",Available,https://nidhiratna.com/products/buddha-figurine-bring-tranquility,06/01/2025
Vajrasattva Statue: Symbol of Purification and Transformation,VSAO 961,"$2,285.60","$2,857.00",Available,https://nidhiratna.com/products/vajrasattva-statue-a-luminous-symbol-of-purification,06/01/2025
Gold Gilded with Turquoise & Coral Accents: Opulent Green Tara Statue,GTDS 939,"$4,960.00","$6,200.00",Available,https://nidhiratna.com/products/gold-gilded-with-turquoise-coral-accents-opulent-green-tara-statue,06/01/2025
Oxidized Copper Shakyamuni Buddha Statue: Perfect for Altars,BSAT 962,$224.00,$280.00,Available,https://nidhiratna.com/products/oxidized-copper-shakyamuni-buddha-statue-perfect-for-altars,06/01/2025
Oxidized Copper Guru Rinpoche Statue with Radiant Gold Face,GRAT 963,$400.00,$500.00,Available,https://nidhiratna.com/products/oxidized-copper-guru-rinpoche-statue-with-radiant-gold-face,06/01/2025
Handcrafted Gold Samantabhadra Statue,SBAO 965,$816.00,"$1,020.00",Available,https://nidhiratna.com/products/handcrafted-gold-samantabhadra-statue,06/01/2025
Oxidized Copper Green Tara: Spiritual Decor with Gold Face Accent,GTAT 964,$460.00,$575.00,Available,https://nidhiratna.com/products/oxidized-copper-green-tara-spiritual-decor-with-gold-face-accent,06/01/2025
Divine Guru Rinpoche Statue: Gold Gilded with Precious Stones,GRAO 966,$888.00,"$1,110.00",Available,https://nidhiratna.com/products/divine-guru-rinpoche-statue-gold-gilded-with-precious-stones,06/01/2025
Goddess of Mercy: Chundi Bodhisattva Statue,CAO 967,"$2,196.00","$2,745.00",Available,https://nidhiratna.com/products/goddess-of-mercy-chundi-bodhisattva-statue,06/01/2025
Protector of All Sentient Beings: Tibetan Chenrezig Statue,CHDN 970,"$1,296.00","$1,620.00",Available,https://nidhiratna.com/products/protector-of-all-sentient-beings-tibetan-chenrezig-statue,06/01/2025
Master of Tantric Buddhism: Guru Rinpoche Statue,GRDN 971,"$1,316.00","$1,645.00",Available,https://nidhiratna.com/products/master-of-tantric-buddhism-guru-rinpoche-statue,06/01/2025
Spiritual Mother of All Beings: Mother Green Tara Statue,GTDN 968,"$1,108.00","$1,385.00",Available,https://nidhiratna.com/products/spiritual-mother-of-all-beings-mother-green-tara-statue,06/01/2025
Lotus Born: Tibetan Guru Rinpoche Sculpture,GRDN 969,$656.00,$820.00,Available,https://nidhiratna.com/products/lotus-born-tibetan-guru-rinpoche-sculpture,06/01/2025
Oxidized Shakyamuni Buddha Statue: Perfect for Buddhist Practice,BSAP 977,$896.00,"$1,120.00",Available,https://nidhiratna.com/products/oxidized-shakyamuni-buddha-statue-perfect-for-buddhist-practice,06/01/2025
Luxurious Spiritual Art for Meditation: Handmade Shakyamuni Buddha,BSAT 979,"$2,616.00","$3,270.00",Available,https://nidhiratna.com/products/luxurious-spiritual-art-for-meditation-handmade-shakyamuni-buddha,06/01/2025
Green Tara Statue: Mother of Compassion & Savior,GTAT 978,"$1,488.00","$1,860.00",Available,https://nidhiratna.com/products/green-tara-statue-mother-of-compassion-savior,06/01/2025
Bodhisattva of Wisdom & Knowledge: Maha Manjushri Statue,MSAP 976,"$2,256.80","$2,821.00",Available,https://nidhiratna.com/products/bodhisattva-of-wisdom-knowledge-maha-manjushri-statue,06/01/2025
Buddhist Deity of Strength & Thunderbolt: Vajrapani Statue,VPAT 980,"$2,288.00","$2,860.00",Available,https://nidhiratna.com/products/buddhist-deity-of-strength-thunderbolt-vajrapani-statue,06/01/2025
Symbol of Impermanence & Transformation: Cittipati Statue,CPDE 973,$896.00,"$1,120.00",Available,https://nidhiratna.com/products/symbol-of-impermanence-transformation-cittipati-statue,06/01/2025
Lord Ganesh Statue: Symbol of Success & Good Fortune,GDE 972,$616.00,$770.00,Available,https://nidhiratna.com/products/lord-ganesh-statue-symbol-of-success-good-fortune,06/01/2025
Handcrafted Dzambhala with Consort Statue,DZDE 975,"$1,348.00","$1,685.00",Available,https://nidhiratna.com/products/handcrafted-dzambhala-with-consort-statue,06/01/2025
The Oxidation of King Gesar: A Symbolic Exploration,CMDE 974,$800.00,"$1,000.00",Available,https://nidhiratna.com/products/the-oxidation-of-king-gesar-a-symbolic-exploration,06/01/2025
White Tara Statue for Compassion & Immortality,WTH 987,"$1,600.00","$2,000.00",Available,https://nidhiratna.com/products/white-tara-statue-for-compassion-immortality,06/01/2025
Spiritual White Tara Sculpture,WTH 988,"$1,520.00","$1,900.00",Available,https://nidhiratna.com/products/spiritual-white-tara-sculpture,06/01/2025
Authentic Oxidized Buddha Shakyamuni Statue,BSDD 989,"$2,064.00","$2,580.00",Available,https://nidhiratna.com/products/authentic-oxidized-buddha-shakyamuni-statue,06/01/2025
Ekajati Statue: Emblem of Fearlessness,EAO 984,$600.00,$750.00,Available,https://nidhiratna.com/products/ekajati-statue-emblem-of-fearlessness,06/01/2025
Oxidized Mother Green Tara Statue for Protection,GTDD 990,"$1,248.00","$1,560.00",Available,https://nidhiratna.com/products/oxidized-mother-green-tara-statue-for-protection,06/01/2025
Handmade Full Oxidized Shakyamuni Buddha Statue,BSDD 991,"$1,144.00","$1,430.00",Available,https://nidhiratna.com/products/handmade-full-oxidized-shakyamuni-buddha-statue,06/01/2025
Sacred Dzambhala Statue: Blessings of Prosperity,DZDD 992,"$1,236.00","$1,545.00",Available,https://nidhiratna.com/products/sacred-dzambhala-statue-blessings-of-prosperity,06/01/2025
Handcrafted Virupaksha Statue: Guardian of the Earth,VAO 985,"$1,016.00","$1,270.00",Available,https://nidhiratna.com/products/handcrafted-virupaksha-statue-guardian-of-the-earth,06/01/2025
Goddess of Dawn & Light Protection: Handmade Marichi Statue,MAO 986,"$1,896.80","$2,371.00",Available,https://nidhiratna.com/products/goddess-of-dawn-light-protection-handmade-marichi-statue,06/01/2025
Exquisite Handcrafted Mother Green Tara Statue,GTAT 994,"$1,425.60","$1,782.00",Available,https://nidhiratna.com/products/exquisite-handcrafted-mother-green-tara-statue,06/01/2025
Amitayus Buddha Deity Statue: Blessings of Longevity,ATAT 995,"$1,425.60","$1,782.00",Available,https://nidhiratna.com/products/amitayus-buddha-deity-statue-blessings-of-longevity,06/01/2025
Handcrafted Vajrapani Statue: The Mighty Protector,VPAT 996,$892.00,"$1,115.00",Available,https://nidhiratna.com/products/handcrafted-vajrapani-statue-the-mighty-protector,06/01/2025
Handmade Dorje Phagmo Statue: The Divine Feminine,DPAP 993,"$1,224.80","$1,531.00",Available,https://nidhiratna.com/products/handmade-dorje-phagmo-statue-the-divine-feminine,06/01/2025
Oxidized Guru Rinpoche Statue: Timeless Artistry for Devotees,GRDD 997,"$1,672.00","$2,090.00",Available,https://nidhiratna.com/products/oxidized-guru-rinpoche-statue-timeless-artistry-for-devotees,06/01/2025
Antique Style Oxidized Green Tara Statue,GTDD 998,"$1,300.00","$1,625.00",Available,https://nidhiratna.com/products/antique-style-oxidized-green-tara-statue,06/01/2025
Oxidized Shakyamuni Buddha Statue: Crafted for Spiritual Serenity,BSDB 999,$864.00,"$1,080.00",Available,https://nidhiratna.com/products/oxidized-shakyamuni-buddha-statue-crafted-for-spiritual-serenity,06/01/2025
Serene Oxidized Shakyamuni Buddha Statue: Perfect for Meditation,BSDB 1000,$864.00,"$1,080.00",Available,https://nidhiratna.com/products/serene-oxidized-shakyamuni-buddha-statue-perfect-for-meditation,06/01/2025
Oxidized Hayagriva Statue: Invoke Protection and Fierce Compassion,HGDE 1001,$932.00,"$1,165.00",Available,https://nidhiratna.com/products/oxidized-hayagriva-statue-invoke-protection-and-fierce-compassion,06/01/2025
Elegant Oxidized Saraswati Statue: Crafted for Wisdom And Artistic Flourishing,SWDE 1002,$737.60,$922.00,Available,https://nidhiratna.com/products/elegant-oxidized-saraswati-statue-crafted-for-wisdom-and-artistic-flourishing,06/01/2025
Handmade Vajrapani Sculpture for Spiritual Defense,VPDE 1003,,,Sold Out,https://nidhiratna.com/products/handmade-vajrapani-sculpture-for-spiritual-defense,06/01/2025
Divine Palden Lhamo Statue,PLDC 1004,"$1,112.00","$1,390.00",Available,https://nidhiratna.com/products/divine-palden-lhamo-statue,06/01/2025
Norlha Namtoshe Wealth God Statue,NTDC 1005,"$1,036.00","$1,295.00",Available,https://nidhiratna.com/products/norlha-namtoshe-wealth-god-statue,06/01/2025
Premium Samantabhadra Statue,SBRS 1006,"$1,112.00","$1,390.00",Available,https://nidhiratna.com/products/premium-samantabhadra-statue,06/01/2025
Goddess Prajnaparamita Buddhist Statue | Icon of Ultimate Wisdom,PPRS 1007,"$3,596.00","$4,495.00",Available,https://nidhiratna.com/products/goddess-prajnaparamita-buddhist-statue-icon-of-ultimate-wisdom,06/01/2025
Ancient 19 Inch Shakyamuni Buddha with Halo,BSAO 1014,"$1,776.80","$2,221.00",Available,https://nidhiratna.com/products/ancient-19-inch-shakyamuni-buddha-with-halo,06/01/2025
13 Inch Gold Gilded Buddha Statue for Spiritual Practice,BSAT 1010,"$1,336.80","$1,671.00",Available,https://nidhiratna.com/products/13-inch-gold-gilded-buddha-statue-for-spiritual-practice,06/01/2025
Nepalese 13.5 Inch Shakyamuni Buddha Statue: Oxidized Copper with Silver Plated,BSAT 1011,$560.00,$700.00,Available,https://nidhiratna.com/products/nepalese-13-5-inch-shakyamuni-buddha-statue-oxidized-copper-with-silver-plated,06/01/2025
8 Inch Shakyamuni Buddha Statue on Lotus,BSAT 1012,$586.40,$733.00,Available,https://nidhiratna.com/products/8-inch-shakyamuni-buddha-statue-on-lotus,06/01/2025
Handcrafted 13 Inch Shakyamuni Buddha Statue in Oxidized Copper,BSAT 1013,$736.80,$921.00,Available,https://nidhiratna.com/products/handcrafted-13-inch-shakyamuni-buddha-statue-in-oxidized-copper,06/01/2025
Elegant 12.5 Inch Buddha Shakyamuni for Divine Decor,BSDB 1015,"$1,384.00","$1,730.00",Available,https://nidhiratna.com/products/elegant-12-5-inch-buddha-shakyamuni-for-divine-decor,06/01/2025
Sacred 8 Inch Gold Shakyamuni Buddha Statue,BSDB 1016,$709.60,$887.00,Available,https://nidhiratna.com/products/sacred-8-inch-gold-shakyamuni-buddha-statue,06/01/2025
Tibetan Milarepa Statue for Buddhist Practitioners,MDB 1017,"$1,840.80","$2,301.00",Available,https://nidhiratna.com/products/tibetan-milarepa-statue-for-buddhist-practitioners,06/01/2025
Meditative Oxidized Samantabhadra Statue,SBDB 1018,$852.00,"$1,065.00",Available,https://nidhiratna.com/products/meditative-oxidized-samantabhadra-statue,06/01/2025
Handmade Mother Green Tara Statue: Embodying Compassion,GTG 1008,"$1,840.00","$2,300.00",Available,https://nidhiratna.com/products/handmade-mother-green-tara-statue-embodying-compassion,06/01/2025
Artisan Handcrafted Mother Green Tara Statue,GTG 1009,"$2,320.00","$2,900.00",Available,https://nidhiratna.com/products/artisan-handcrafted-mother-green-tara-statue,06/01/2025
Premium 12.8 Inch Shakyamuni Buddha Statue,BSH 981,"$1,488.00","$1,860.00",Available,https://nidhiratna.com/products/premium-12-8-inch-shakyamuni-buddha-statue,06/01/2025
Exquisite Shakyamuni Buddha Statue: Timeless Buddhist Art,BSH 982,"$1,412.80","$1,766.00",Available,https://nidhiratna.com/products/exquisite-shakyamuni-buddha-statue-timeless-buddhist-art,06/01/2025
Large Buddha Shakyamuni Statue with Halo: Spiritual Masterpiece,BSH 983,"$1,440.00","$1,800.00",Available,https://nidhiratna.com/products/large-buddha-shakyamuni-statue-with-halo-spiritual-masterpiece,06/01/2025
Sacred Green Tara Statue: Symbol of Swift Compassion,GTDD 1019,,,Sold Out,https://nidhiratna.com/products/sacred-green-tara-statue-symbol-of-swift-compassion,06/01/2025
Oxidized Guru Norla Statue:  Attract Wealth and Blessings to Your Life,GRDD 1020,"$2,496.00","$3,120.00",Available,https://nidhiratna.com/products/oxidized-guru-norla-statue-attract-wealth-and-blessings-to-your-life,06/01/2025
Green Dzambhala with Consort Statue:  Symbol of Prosperity and Harmony,DZDE 1022,"$1,348.00","$1,685.00",Available,https://nidhiratna.com/products/green-dzambhala-with-consort-statue-symbol-of-prosperity-and-harmony,06/01/2025
Sacred 15.7 Inch Oxidized Vajrasattva Statue,VSRS 1033,"$2,856.00","$3,570.00",Available,https://nidhiratna.com/products/sacred-15-7-inch-oxidized-vajrasattva-statue,06/01/2025
Artistic 12.8 Inch Oxidized Green Tara Statue,GTDE 1021,$880.00,"$1,100.00",Available,https://nidhiratna.com/products/artistic-12-8-inch-oxidized-green-tara-statue,06/01/2025
Oxidized 8.8 Inch Kshitigarbha Buddha Statue,KSDE 1023,$480.00,$600.00,Available,https://nidhiratna.com/products/oxidized-8-8-inch-kshitigarbha-buddha-statue,06/01/2025
Oxidized Akashgarbha Statue : Keeper of Wisdom and Space,AKDE 1024,$480.00,$600.00,Available,https://nidhiratna.com/products/oxidized-akashgarbha-statue-keeper-of-wisdom-and-space,06/01/2025
Handmade 8.8 Inch Four-Armed Chenrezig Buddha Statue,CHDE 1025,$480.00,$600.00,Available,https://nidhiratna.com/products/handmade-8-8-inch-four-armed-chenrezig-buddha-statue,06/01/2025
Artisan-Made Karmapa Statue for Practitioners,KRS 1029,"$1,200.00","$1,500.00",Available,https://nidhiratna.com/products/artisan-made-karmapa-statue-for-practitioners,06/01/2025
9.6 Inch Oxidized Green Tara: Goddess of Protection,GTRS 1030,"$1,676.00","$2,095.00",Available,https://nidhiratna.com/products/9-6-inch-oxidized-green-tara-goddess-of-protection,06/01/2025
Great Master Tsongkhapa Statue: Ideal for Meditation,TKRS 1031,"$1,067.20","$1,334.00",Available,https://nidhiratna.com/products/great-master-tsongkhapa-statue-ideal-for-meditation,06/01/2025
9.66 Inch Dorje Sempa Statue for Tibetan Spirituality,VSRS 1032,"$2,000.00","$2,500.00",Available,https://nidhiratna.com/products/9-66-inch-dorje-sempa-statue-for-tibetan-spirituality,06/01/2025
21.2 Inch Guru Rinpoche Statue | Master of Vajrayana Buddhism,GRAT 1035,,,Sold Out,https://nidhiratna.com/products/21-2-inch-guru-rinpoche-statue-master-of-vajrayana-buddhism,06/01/2025
Gold-Gilded Vajrapani Statue:  Symbol of Strength in Tibetan Buddhism,VPAT 1036,$736.80,$921.00,Available,https://nidhiratna.com/products/gold-gilded-vajrapani-statue-symbol-of-strength-in-tibetan-buddhism,06/01/2025
Two-Armed Chenrezig: Guardian of Compassion,CHG 1028,"$1,832.00","$2,290.00",Available,https://nidhiratna.com/products/two-armed-chenrezig-guardian-of-compassion,06/01/2025
Six-Armed Mahakala Deity Statue | Fierce Protector,SAMAO 1034,"$1,713.60","$2,142.00",Available,https://nidhiratna.com/products/six-armed-mahakala-deity-statue-fierece-protector,06/01/2025
Sacred Mother Green Tara Statue in Meditative Pose,GTDD 1038,"$1,352.00","$1,690.00",Available,https://nidhiratna.com/products/sacred-mother-green-tara-statue-in-meditative-pose,06/01/2025
Enlightened Yogi Virupa Statue,VDD 1037,"$1,292.80","$1,616.00",Available,https://nidhiratna.com/products/enlightened-yogi-virupa-statue,06/01/2025
Unique Mitrugpa Statue: Tibetan Cultural Heritage,MGD 1039,"$2,240.00","$2,800.00",Available,https://nidhiratna.com/products/unique-mitrugpa-statue-tibetan-cultural-heritage,06/01/2025
Consecration Charge,consecration-charge,$75.00,$75.00,Available,https://nidhiratna.com/products/consecration-charge,06/01/2025
14 Inch Authentic Manjushri Statue,MSH 1042,"$1,412.80","$1,766.00",Available,https://nidhiratna.com/products/14-inch-authentic-manjushri-statue,06/01/2025
Glistening Silver Shakyamuni Buddha Statue,BSH 1043,$932.00,"$1,165.00",Available,https://nidhiratna.com/products/glistening-silver-shakyamuni-buddha-statue,06/01/2025
13.5 Inch Matte Mother Green Tara Sculpture,GTH 1044,"$1,280.00","$1,600.00",Available,https://nidhiratna.com/products/13-5-inch-matte-mother-green-tara-sculpture,06/01/2025
Regal Mitrugpa on Throne Statue | A Majestic Representation of Compassion,MGD 1040,"$4,800.00","$6,000.00",Available,https://nidhiratna.com/products/regal-mitrugpa-on-throne-statue-a-majestic-representation-of-compassion,06/01/2025
Handmade Majestic 16.5 Inch Guru Rinpoche Statue,GRG 1026,"$2,720.00","$3,400.00",Available,https://nidhiratna.com/products/handmade-majestic-16-5-inch-guru-rinpoche-statue,06/01/2025
Masterpiece 15.5 Inch Guru Rinpoche Statue: A Spiritual Treasure,GRG 1027,,,Sold Out,https://nidhiratna.com/products/masterpiece-15-5-inch-guru-rinpoche-statue-a-spiritual-treasure,06/01/2025
18 Inch Oxidized Padmasambhava Sculpture,GRDD 1046,"$2,054.40","$2,568.00",Available,https://nidhiratna.com/products/18-inch-oxidized-padmasambhava-sculpture,06/01/2025
Tibetan Mother Dolma Statue in Oxidized Copper,GTDD 1047,$596.00,$745.00,Available,https://nidhiratna.com/products/tibetan-mother-dolma-statue-in-oxidized-copper,06/01/2025
18.7 Inch Serene White Tara Statue,WTAT 1045,"$1,292.80","$1,616.00",Available,https://nidhiratna.com/products/18-7-inch-serene-white-tara-statue,06/01/2025
Tibetan Dorje Lekpa Statue for Peace and Protection,DLDE 1048,$920.00,"$1,150.00",Available,https://nidhiratna.com/products/tibetan-dorje-lekpa-statue-for-peace-and-protection,06/01/2025
Wrathful Vajrapani Protector Statue,VPDE 1049,$920.00,"$1,150.00",Available,https://nidhiratna.com/products/wrathful-vajrapani-protector-statue,06/01/2025
Timeless Buddha Statue of Shakyamuni,BSBN 1052,"$1,040.00","$1,300.00",Available,https://nidhiratna.com/products/timeless-buddha-statue-of-shakyamuni,06/01/2025
Dorje Drollo Buddhist Statue in Oxidized Copper,DDDE 1051,$936.00,"$1,170.00",Available,https://nidhiratna.com/products/dorje-drollo-buddhist-statue-in-oxidized-copper,06/01/2025
Two-Armed Chenresig Statue: Compassionate Deity on Lion,CHDE 1050,"$1,120.00","$1,400.00",Available,https://nidhiratna.com/products/two-armed-chenresig-statue-compassionate-deity-on-lion,06/01/2025
The Awakened One Shakyamuni Buddha Statue: Limited Edition,BSDG 1053,"$1,400.00","$1,750.00",Available,https://nidhiratna.com/products/the-awakened-one-shakyamuni-buddha-statue-limited-edition,06/01/2025
