Title,SKU,Sale_Price,Regular_Price,Availability,Link,Date
Green Tara Statue: Protection and Peace,GTA 1,,,Sold Out,https://nidhiratna.com/products/green-tara-statue-gold,2025-06-06
Radiant Shakyamuni Buddha Sculpture,BSA 2,,,Sold Out,https://nidhiratna.com/products/buddha-shakyamuni-gold,2025-06-06
Gold Gilded Guru Rinpoche Statue,GRA 3,$852.00,$1065.00,Available,https://nidhiratna.com/products/gold-gilded-guru-rinpoche-statue-1,2025-06-06
Bodhisattva Amitayus,ATA 4,$832.00,$1040.00,Available,https://nidhiratna.com/products/amitayus-buddha-sculpture,2025-06-06
Traditional Shakyamuni Buddha,5 BSA,,,Sold Out,https://nidhiratna.com/products/shakyamuni-buddha-siddhartha-gautam,2025-06-06
Shakyamuni Buddha Statue,6 BSA,$2180.00,$2725.00,Available,https://nidhiratna.com/products/shakyamuni-buddha-statue-3,2025-06-06
Divine Mother Tara: Protection & Swift Action,7 GTA,,,Sold Out,https://nidhiratna.com/products/divine-mother-tara,2025-06-06
White Tara Golden Statue: Compassion and Wisdom,WTA 8,$1256.00,$1570.00,Available,https://nidhiratna.com/products/white-tara-tibetan-deity-tara,2025-06-06
Dzambhala : The Wealth Deity,DZA 9,$1088.00,$1360.00,Available,https://nidhiratna.com/products/dzambhala-the-wealth-deity,2025-06-06
Guru Rinpoche Statue Lotus Born Master,GRA 10,$1732.00,$2165.00,Available,https://nidhiratna.com/products/guru-rinpoche-lotus-master-padmasambhav,2025-06-06
Namgyalma Mantra Statue : The Divine Protector of Longevity and Purification,NGA 11,$1336.00,$1670.00,Available,https://nidhiratna.com/products/protector-of-longevity-and-purification-namgyalma,2025-06-06
Kalachakra Deity Statue: Tibetan Buddhist  Sculpture,12 KCA,$1552.00,$1940.00,Available,https://nidhiratna.com/products/kalachakra-statue-mandala,2025-06-06
Namgyalma (Ushnisa Vijaya) Sculpture | A Divine Statue of Peace and Healing,NGA 13,,,Sold Out,https://nidhiratna.com/products/namgyalma-nga-ushnisavijaya-tibetan-deity,2025-06-06
Vajrasattva Statue: The Glorious Bodhisattva of Purification,VSA 14,,,Sold Out,https://nidhiratna.com/products/vajrasattva-bodhisattva-purifier,2025-06-06
Manjushri: Guardian of Knowledge and Clarity,MSA 15,,,Sold Out,https://nidhiratna.com/products/manjushri-manjushree-bodhisattva-statue,2025-06-06
White Tara: The Compassionate Mother of Longevity and Healing,WTA 16,,,Sold Out,https://nidhiratna.com/products/white-tara-buddha-female,2025-06-06
The Power of Dzambhala: Invoking Wealth and Prosperity,18 DZA,,,Sold Out,https://nidhiratna.com/products/dzambhala-wealth-deity-kuber-statue,2025-06-06
Kshitigarbha Statue | Guardian of Souls,KGA 19,,,Sold Out,https://nidhiratna.com/products/kshitigarbha-gaurdian-of-sould-bodhisattva,2025-06-06
The Golden Buddhist Statue : Amitabha Buddha,ABA 21,$1016.00,$1270.00,Available,https://nidhiratna.com/products/amitabha-buddha-compassion-buddha,2025-06-06
Unlocking the Power of Vajrapani: Protector and Guide in Buddhist Tradition,20 VPA,$1344.00,$1680.00,Available,https://nidhiratna.com/products/vajrapani-deityofpower-bodhisattva,2025-06-06
Vajradhara: The Primordial Buddha of Tantric Buddhism,VDA 22,$764.00,$955.00,Available,https://nidhiratna.com/products/vajradhara-bodhisattva-staute-sculpture,2025-06-06
Kshitigarbha | Buddhist Bodhisattva Statue,23 KGA,$760.00,$950.00,Available,https://nidhiratna.com/products/kshitigarbha-bodhisattva-statue-sculpture,2025-06-06
Green Tara: The Compassionate Savior in Tibetan Buddhism,GTA 24,,,Sold Out,https://nidhiratna.com/products/green-tara-mothertara-tara-statue,2025-06-06
Vajrapani : The Symbolism and Significance of the Thunderbolt-Bearing,VPA 25,,,Sold Out,https://nidhiratna.com/products/symbolism-and-significance-of-the-thunderbolt,2025-06-06
Amitayus Buddha: Bestower of Long Life and Enlightenment,ATA 26,,,Sold Out,https://nidhiratna.com/products/26-amitayus-buddha-statue,2025-06-06
The Radiant Glory of Amitabha Buddha,27 ABA,$360.00,$450.00,Available,https://nidhiratna.com/products/27-amitabha-buddha-statue,2025-06-06
Empowerment through Vajrapani: Embodying Strength and Resilience in Buddhist Practice,28 VPA,,,Sold Out,https://nidhiratna.com/products/28-vajrapani-bodhisattva-statue,2025-06-06
Amitabha: The Shining Protector,29 ABA,$956.00,$1195.00,Available,https://nidhiratna.com/products/amitabha-buddha-statue-amitabha,2025-06-06
Dukar Statue: Spiritual Strength,DKA 30,$716.00,$895.00,Available,https://nidhiratna.com/products/dukar-statue-spiritual-strength-statues,2025-06-06
"Buddha Sakyamuni Statue - Silver Plated Body, Gold Face, Handcrafted",31 BSA,,,Sold Out,https://nidhiratna.com/products/buddha-shakyamuni-sliver-plated-body,2025-06-06
Transcendence in Gold : The Buddha Sculpture Crafted in 24K Splendor,32 BSA,$332.00,$415.00,Available,https://nidhiratna.com/products/uddha-sculpture-crafted-in-24k-splendor-statue,2025-06-06
Green Tara: Syamatara Buddhist Sculpture,GTA 17,,,Sold Out,https://nidhiratna.com/products/green-tara-sayamatara-mothertara-statue,2025-06-06
Four-Armed Chenrezig Statue | 24K Gold Gilded and Oxidized Copper,33 CHA,,,Sold Out,https://nidhiratna.com/products/33-chenresig-four-armed-chenrezig-statue-sculpture,2025-06-06
Amitayus Buddha : The Luminous Buddha of Endless Life,34 ATA,,,Sold Out,https://nidhiratna.com/products/33-amitayus-buddha-statue,2025-06-06
Longchenpa | Longchen Rabjam Oxidized Copper Statue,35 LGA,,,Sold Out,https://nidhiratna.com/products/longchenpa-longchen-rabjam,2025-06-06
Buddha Shakyamuni | Tibetan Buddhist Statue,36 BSA,,,Sold Out,https://nidhiratna.com/products/36-buddha-shakyamuni-gautam-buddha-statue,2025-06-06
Amitabha: Light of Compassion and Wisdom,ABA 37,$1472.00,$1840.00,Available,https://nidhiratna.com/products/37-amitabha-buddha-wisdom-compassion-statue,2025-06-06
Enlightenment Under the Bodhi Tree : Sakyamuni Buddha,38 BSA,,,Sold Out,https://nidhiratna.com/products/enlightenment-sakyamuni-buddha-gautam-buddha-statue,2025-06-06
1000 Armed Chenrezig  Statue : Transformation and Liberation,39 CHA,$792.00,$990.00,Available,https://nidhiratna.com/products/1000-chenresig-statue-sculpture,2025-06-06
Chenrezig: Buddhist Avalokiteshvara Statue Glided with 24K Gold,40 CHR,,,Sold Out,https://nidhiratna.com/products/40-chenresig-avalokiteshvara-statue,2025-06-06
Manjushri: The Enlightened Sage,41 MSR,,,Sold Out,https://nidhiratna.com/products/41-manjushri-bodhisattva-statue,2025-06-06
Shakyamuni Buddha Statue | Glided with 24K Gold,42 BSR,$1240.00,$1550.00,Available,https://nidhiratna.com/products/42-buddha-shakyamuni-gautama-buddha-statue,2025-06-06
Vajrasattva : The Deity of Purification,43 VSR,,,Sold Out,https://nidhiratna.com/products/43-vajrasattva-bodhisattva-statue,2025-06-06
Golden Enlightenment: The Buddha in 24K Gold,44 BSR,,,Sold Out,https://nidhiratna.com/products/44-shakyamuni-gautama-buddha-statue,2025-06-06
Vajrasattva : The Purification and Restoration of Vows,45 VSR,,,Sold Out,https://nidhiratna.com/products/vajrasattva-deity-of-purification-statue-dorje-sempa,2025-06-06
Beautiful Handcrafted Buddha Sakyamuni Statue,46 BSR,$904.00,$1130.00,Available,https://nidhiratna.com/products/buddha-shakyamuni-buddha-statue,2025-06-06
Amitabha Buddha : The Infinite Shining One,ABR 47,$904.00,$1130.00,Available,https://nidhiratna.com/products/47-amitabha-buddha-statue-buddhist-statue,2025-06-06
Siddhartha Gautama Statue | Beautiful Handcrafted Buddhist Statue,48 BSR,$1072.00,$1340.00,Available,https://nidhiratna.com/products/handcrafted-buddhist-statue-siddhartha-gautama,2025-06-06
Manjushri : The Bodhisattva of Wisdom,49 MSR,,,Sold Out,https://nidhiratna.com/products/49-manjushri-deity-of-wisdom-bodhisattva,2025-06-06
Golden Radiance and Timeless Wisdom: The Medicine Buddha in Gold,52 MBR,,,Sold Out,https://nidhiratna.com/products/medicine-buddha-in-gold-statue,2025-06-06
White Tara : The Mother of Compassion,50 WTR,$820.00,$1025.00,Available,https://nidhiratna.com/products/50-white-tara-mother-tara-statue,2025-06-06
Shakyamuni Buddha : Bask in the Brilliance of Spiritual Illumination,53 BSR,$1324.00,$1655.00,Available,https://nidhiratna.com/products/shakyamuni-buddha-statue-gautamabuddha,2025-06-06
Amitabha Buddha : The Buddha of the Western Pure Land,ABR 54,,,Sold Out,https://nidhiratna.com/products/amitabha-buddha-statue-buddha,2025-06-06
Tsongkhapa Triad: Three Unique Expressions,55 TKR,,,Sold Out,https://nidhiratna.com/products/tsongkhapa-triad-three-unique-expressions,2025-06-06
Mahakala Bernagchen: Guardian of the Sacred Path,MKBR 56,$820.00,$1025.00,Available,https://nidhiratna.com/products/mahakala-bernagchen-guardian-of-the-sacred-path,2025-06-06
Radiant Majesty: The Crowned Shakyamuni Buddha in Gold,57 CBSR,$820.00,$1025.00,Available,https://nidhiratna.com/products/crowned-buddha-shakyamuni-buddha-statue,2025-06-06
Medicine Buddha : The Healing Radiance,58 MBR,,,Sold Out,https://nidhiratna.com/products/medicine-buddha-healing-buddha-1,2025-06-06
"Triumphant Grace: Namgyalma, the Three-Faced Goddess",59 NGR,,,Sold Out,https://nidhiratna.com/products/namgyalma-the-three-faced-goddess-statuess,2025-06-06
Divine Contemplation: The Golden Milarepa Statue,60 MR,$660.00,$825.00,Available,https://nidhiratna.com/products/the-golden-milarepa-statue-in-buddhist,2025-06-06
Marpha's Essence: Unveiling Lhodak Marpa Choski Lodos,61 MR,,,Sold Out,https://nidhiratna.com/products/marpa-buddhist-master-statue-guru-statue,2025-06-06
The Radiant Wisdom: Exploring the Teachings of Gampopa,62 GPR,,,Sold Out,https://nidhiratna.com/products/the-teachings-of-gampopa,2025-06-06
Prosperity's Guardian: The Dzambhala Statue,63 DZR,$488.00,$610.00,Available,https://nidhiratna.com/products/guardian-the-dzambhala-statue,2025-06-06
Manjushri Bodhisattva | Embodiment of Enlightened Wisdom,64 MSR,,,Sold Out,https://nidhiratna.com/products/manjushri-bodhisattva-embodiment-of-enlightened-wisdom,2025-06-06
Vajrasattva : Embodiment of Purity,65 VSR,$2400.00,$3000.00,Available,https://nidhiratna.com/products/vajrasattva-purity-deity-statue,2025-06-06
Sakya Mahakala : Guardian of the Sakya Lineage,66 SMR,$652.00,$815.00,Available,https://nidhiratna.com/products/sakya-mahakala-black-protector-statue,2025-06-06
Beyond Vision: The Third Eye of Indra and Cosmic Wisdom,67 INR,$1188.00,$1485.00,Available,https://nidhiratna.com/products/the-third-eye-of-indra-and-cosmic-wisdom-statue,2025-06-06
The Healing Buddha: Bhaisajyaguru's Vows and Powers,68 MBR,$916.00,$1145.00,Available,https://nidhiratna.com/products/the-healing-buddha-bhaisajyagurus-statue,2025-06-06
White Dzambhala :The Prosperity Guardian atop the Dragon,69 WDZR,$648.00,$810.00,Available,https://nidhiratna.com/products/69-white-dzambhala-kuber-statue,2025-06-06
Compassion Embodied: The Seated Chenrezig Statue,70 CHR,$2612.00,$3265.00,Available,https://nidhiratna.com/products/chenresig-oxidized-chenrezig,2025-06-06
Enlightened Presence: The Karmapa Statue in Tibetan Buddhism,71 KPR,$744.00,$930.00,Available,https://nidhiratna.com/products/the-karmapa-statue-in-tibetan-buddhism,2025-06-06
The Fasting Buddha: An Emblem of Perseverance and Balance,72 BSR,$672.00,$840.00,Available,https://nidhiratna.com/products/fasting-buddha-shakyamuni-buddha-statue,2025-06-06
Radiant Wisdom: Understanding the Spectrum of Guru Rinpoche's,73 GRR,$1272.00,$1590.00,Available,https://nidhiratna.com/products/understanding-the-spectrum-of-guru-rinpoches,2025-06-06
The Bodhi Tree's Guardian: Shakyamuni Buddha's Compassionate Light,74 BSBP,,,Sold Out,https://nidhiratna.com/products/bodhi-trees-guardian-shakyamuni-buddhas,2025-06-06
Sacred Medicine: The Medicine Buddha's Journey to Enlightenment,75 MBBP,,,Sold Out,https://nidhiratna.com/products/medicine-buddha-sacred-medicine-statue,2025-06-06
Eternal Light: Exploring the Amitabha Buddha Statue,ABBP 76,$2400.00,$3000.00,Available,https://nidhiratna.com/products/amitabha-buddhha-statue-beacon-of-compassion,2025-06-06
Emerald Grace: The Green Tara Statue,77 GTBP,,,Sold Out,https://nidhiratna.com/products/green-tara-ststue-emerald-grace,2025-06-06
Vajrakilaya: The Thunderbolt of Enlightenment,78 VKBP,$1588.00,$1985.00,Available,https://nidhiratna.com/products/78-vajrakilaya-thunderbolt-statue,2025-06-06
Guru Rinpoche: The Padmasambhava Teachings,79 GRBP,$748.00,$935.00,Available,https://nidhiratna.com/products/guru-rinpoche-padmasambhava-statue-in-gold,2025-06-06
Trilogy of Enlightenment: The Three Buddha Set,80 TBSBP,,,Sold Out,https://nidhiratna.com/products/trilogy-of-enlightenment-the-three-buddha-set-statue,2025-06-06
Dzambhala Statue: Manifesting Wealth and Prosperity,81 DZBP,$1272.00,$1590.00,Available,https://nidhiratna.com/products/dzambhala-statue-kuber-wealth-deity,2025-06-06
Purifying Light: The Vajrasattva Statue,82 VSBP,$760.00,$950.00,Available,https://nidhiratna.com/products/purifying-light-the-vajrasattva-statue,2025-06-06
Regal Serenity: The Crowned Shakyamuni Buddha,CBSBP 83,$880.00,$1100.00,Available,https://nidhiratna.com/products/regal-serenity-the-crowned-shakyamuni-buddha,2025-06-06
"The Tsongkhapa Triad: Embodiments of Wisdom, Compassion & Enlightenment",84 TKBP,$3788.00,$4735.00,Available,https://nidhiratna.com/products/the-tsongkhapa-triad-enlightenment,2025-06-06
Arya Tara Green Tara Statue | Himalayan Spiritual Art,85 GTBP,$5680.00,$7100.00,Available,https://nidhiratna.com/products/arya-tara-green-tara-statue-himalayan-spiritual-art,2025-06-06
Green Tara: The Compassionate Guardian,86 GTBP,,,Sold Out,https://nidhiratna.com/products/green-tara-statue-mother-tara,2025-06-06
Divine Manjushri Statue,MSBP 90,$8240.00,$10300.00,Available,https://nidhiratna.com/products/divine-manjushri-statue,2025-06-06
The Mighty Garuda: Mythical Bird of Legend,93 MGDR,$108.00,$135.00,Available,https://nidhiratna.com/products/the-mighty-garuda-mythical-bird,2025-06-06
Vajrayogini: The Divine Consort of Enlightenment,94 MVYR,,,Sold Out,https://nidhiratna.com/products/vajrayogini-the-divine-consort-statue,2025-06-06
Chakrasamvara: The Embodiment of Bliss and Emptiness,95 MCKR,$332.00,$415.00,Available,https://nidhiratna.com/products/chakrasamvara-the-embodiment-of-bliss-and-emptiness,2025-06-06
Chenrezig Bodhisattva Statue,CHBP 96,$924.00,$1155.00,Available,https://nidhiratna.com/products/chenrezig-bodhisattva-statue,2025-06-06
The Thousand- Armed Chenrezig: Manifestation of Compassionate Wisdom,CHBP 97,$2344.00,$2930.00,Available,https://nidhiratna.com/products/the-thousand-armed-chenrezig-statue,2025-06-06
White Tara: Goddess of Compassion and Longevity,WTBP 98,$916.00,$1145.00,Available,https://nidhiratna.com/products/white-tara-goddess-of-compassion-and-longevity,2025-06-06
Vajrasattva: Purification and Enlightenment,VSBP 99,,,Sold Out,https://nidhiratna.com/products/vajrasattva-purification-and-enlightenment,2025-06-06
Amitayus: Fountain of Infinite Life and Boundless Compassion,100 ATBP,$928.00,$1160.00,Available,https://nidhiratna.com/products/fountain-of-infinite-life-statues,2025-06-06
Radiant Vajrayogini Statue,91 MVYR,$316.00,$395.00,Available,https://nidhiratna.com/products/radiant-vajrayogini-statue,2025-06-06
Majestic Dorje Drolo Statue,MDDR 92,,,Sold Out,https://nidhiratna.com/products/majestic-dorje-drolo-statue,2025-06-06
Green Tara: Goddess of Compassion and Swift Protection,GTBP 101,,,Sold Out,https://nidhiratna.com/products/green-tara-statue-gold-statues-in-buddhist,2025-06-06
Amitabha Buddha: Radiant Symbol of Infinite Light & Boundless Compassion,102 ABBP,$844.00,$1055.00,Available,https://nidhiratna.com/products/infinite-light-and-boundless-compassion-amitabha-buddha,2025-06-06
White Tara: Embodiment of Serenity and Wisdom,WTBP 103,$756.00,$945.00,Available,https://nidhiratna.com/products/white-tara-embodiment-of-serenity-and-wisdom,2025-06-06
Buddha Sakyamuni: Enlightened One of the Sakya,BSBP 104,$844.00,$1055.00,Available,https://nidhiratna.com/products/buddha-sakyamuni-enlightened-statue,2025-06-06
Green Tara: Goddess of Compassion,GTBP 124,,,Sold Out,https://nidhiratna.com/products/green-tara-goddess-of-compassion-statue,2025-06-06
Saraswati: Goddess of Knowledge and Wisdom,SWBP 125,$1444.00,$1805.00,Available,https://nidhiratna.com/products/saraswati-goddess-of-knowledge-and-wisdom,2025-06-06
Medicine Buddha: Healing Light of Compassionate Wisdom,MBBP 105,$756.00,$945.00,Available,https://nidhiratna.com/products/medicine-buddha-healing-buddha-statue,2025-06-06
White Tara Goddess Statue,WTBP 106,$588.00,$735.00,Available,https://nidhiratna.com/products/white-tara-goddess-statue,2025-06-06
Mitrugpa: The Imperturbable Buddha,MGBP 107,,,Sold Out,https://nidhiratna.com/products/mitrugpa-the-imperturbable-buddha,2025-06-06
White Tara: The Embodiment of Wisdom and Compassion,WTA 88,$2428.00,$3035.00,Available,https://nidhiratna.com/products/white-tara-statue-mother-tara,2025-06-06
Divine Medicine Buddha Statue,MBBP 89,$2080.00,$2600.00,Available,https://nidhiratna.com/products/divine-medicine-buddha-statue,2025-06-06
Chenrezig: The Embodiment of Compassion,CHA 87,$2476.00,$3095.00,Available,https://nidhiratna.com/products/chenrezig-statue-buddhist-statue,2025-06-06
Namgyalma: The Goddess of Longevity and Purification,NGBP 108,$756.00,$945.00,Available,https://nidhiratna.com/products/namgyalma-the-goddess-of-longevity-and-purification,2025-06-06
Green Tara: The Swift Savior and Compassionate Mother,GTBP 109,,,Sold Out,https://nidhiratna.com/products/green-tara-the-swift-savior-and-compassionate-mother,2025-06-06
Maitreya Buddha: The Future Buddha,MBBP 121,$1040.00,$1300.00,Available,https://nidhiratna.com/products/maitreya-buddha-the-future-buddha-statue,2025-06-06
The Sacred Deity Namgyalma,NGBP 122,$1444.00,$1805.00,Available,https://nidhiratna.com/products/the-sacred-deity-namgyalma-statue,2025-06-06
Chenrezig: The Embodiment of Infinite Compassion,CHBP 111,,,Sold Out,https://nidhiratna.com/products/chenrezig-the-embodiment-of-infinite-statue,2025-06-06
"Vajrasattva: The Purifier of Body, Speech, and Mind",VSBP 112,$2796.00,$3495.00,Available,https://nidhiratna.com/products/vajrasattva-the-purifier-of-body-speech-and-mind,2025-06-06
Manjushri: The Bodhisattva of Wisdom and Insight,MSBP 110,,,Sold Out,https://nidhiratna.com/products/manjushri-the-bodhisattva-of-wisddom-statue,2025-06-06
Amitayus: The Buddha of Infinite Life and Light,ATBP 113,,,Sold Out,https://nidhiratna.com/products/amitayus-the-buddha-of-infinite-life-statue,2025-06-06
Crowned Buddha Sakyamuni: The Regal Sage of Enlightenment,CBSBP 114,$1948.00,$2435.00,Available,https://nidhiratna.com/products/crowned-buddha-sakyamuni-statue,2025-06-06
Chenrezig: The Embodiment of Compassion in Tibetan Buddhism,CHBP 115,$2328.00,$2910.00,Available,https://nidhiratna.com/products/chenrezig-the-embodiment-of-compassion-statue,2025-06-06
Buddha Shakyamuni: Light of Liberation,BSBP 116,$2328.00,$2910.00,Available,https://nidhiratna.com/products/buddha-shakyamuni-statue,2025-06-06
"Guru Rinpoche: The Second Buddha, Vajrayana Buddhism",GRBP 117,$2644.00,$3305.00,Available,https://nidhiratna.com/products/guru-rinpoche-the-second-buddha-statue,2025-06-06
Buddha Shakyamuni: The Founder of Buddhism,BSBP 126,$784.00,$980.00,Available,https://nidhiratna.com/products/buddha-shakyamuni-gautama-buddha-statues,2025-06-06
Vajrasattva: Purification and Transformation,VSBP 127,$1108.00,$1385.00,Available,https://nidhiratna.com/products/vajrasattva-purification-deity-statue,2025-06-06
White Tara: The Compassionate Mother,WTBP 128,$604.00,$755.00,Available,https://nidhiratna.com/products/white-tara-the-compassionate-mother,2025-06-06
Manjushri: The Radiant Sage of Enlightenment,MSBP 129,,,Sold Out,https://nidhiratna.com/products/manjushri-the-radiant-sage-of-enlightenment-statue,2025-06-06
Dzambhala: Bodhisattva of Wealth and Prosperity,DZBP 130,$588.00,$735.00,Available,https://nidhiratna.com/products/dzambhala-bodhisattva-of-wealth-statue,2025-06-06
Chenrezig: The Compassionate Bodhisattva,CHBP 131,$588.00,$735.00,Available,https://nidhiratna.com/products/chenrezig-the-compassionate-bodhisattva-statue,2025-06-06
Green Tara: The Ever-Compassionate Savior,GTBP 132,,,Sold Out,https://nidhiratna.com/products/green-tara-the-ever-compassionate-savior-statue,2025-06-06
Chenrezig: The Bodhisattva of Infinite Compassion,133 CHBP,,,Sold Out,https://nidhiratna.com/products/chenrezig-the-bodhisattva-of-compassion-statues-altars,2025-06-06
Green Tara: The Divine Mother of Liberation,GTBP 134,,,Sold Out,https://nidhiratna.com/products/green-tara-the-divine-mother-statue,2025-06-06
White Tara: Goddess of Peace and Healing,WTBP 135,$588.00,$735.00,Available,https://nidhiratna.com/products/white-tara-goddess-of-peace-statue,2025-06-06
Dzambhala: Guardian of Wealth and Fortune,DZBP 136,$756.00,$945.00,Available,https://nidhiratna.com/products/dzambhala-guardian-of-wealth-and-fortune-statue,2025-06-06
Six-Armed Mahakala: Guardian of Wisdom and Protector of Devotees,SAMBP 137,$3248.00,$4060.00,Available,https://nidhiratna.com/products/six-armed-mahakala-guardian-of-wisdom-statue,2025-06-06
Dzambhala: The Wealth Bestower,DZBP 138,,,Sold Out,https://nidhiratna.com/products/dzambhala-the-wealth-bestower-statue,2025-06-06
Vajrasattva: Purification of the Mind,VSBP 139,$1276.00,$1595.00,Available,https://nidhiratna.com/products/vajrasattva-purification-of-the-mind-statue,2025-06-06
Amitabha: The Buddha of Infinite Light,ABBP 141,$764.00,$955.00,Available,https://nidhiratna.com/products/amitabha-the-buddha-of-infinite-light-statue,2025-06-06
Amitayus: The Buddha of Eternal Life,ATBP 142,$672.00,$840.00,Available,https://nidhiratna.com/products/amitayus-the-buddha-of-eternal-life-statue,2025-06-06
Buddha Shakyamuni: The One Who Achieved Enlightenment,BSBP 123,$1788.00,$2235.00,Available,https://nidhiratna.com/products/buddha-shakyamuni-statue-1,2025-06-06
Buddha Shakyamuni: The Enlightened One,BSBR 179,,,Sold Out,https://nidhiratna.com/products/buddha-shakyamuni-statue-gautama-buddha,2025-06-06
Radiant Serenity: The Golden Amitayus,ATBR 180,$1359.20,$1699.00,Available,https://nidhiratna.com/products/radiant-serenity-the-golden-amitayus-statue,2025-06-06
Wisdom's Radiance: The Manjushri Statue,MSBR 181,$1359.20,$1699.00,Available,https://nidhiratna.com/products/wisdoms-radiance-the-manjushri-statue,2025-06-06
Emerald Grace: The Statue of Green Tara,GTBR 182,$1359.20,$1699.00,Available,https://nidhiratna.com/products/emerald-grace-the-green-tara-statue,2025-06-06
Golden Radiance: The Vajrasattva Statue,VSBR 183,$1359.20,$1699.00,Available,https://nidhiratna.com/products/golden-radiance-the-vajrasattva-statue,2025-06-06
Eternal Essence: The Oxidized Copper Amitayus,ATBR 184,$1199.20,$1499.00,Available,https://nidhiratna.com/products/eternal-essence-the-oxidized-copper-amitayus-statue,2025-06-06
Eternal Compassion: The Oxidized Copper Four-Armed Chenrezig,CHBR 185,$1199.20,$1499.00,Available,https://nidhiratna.com/products/eternal-compassion-the-oxidized-copper-chenrezig,2025-06-06
Verdant Grace: The Oxidized Copper Green Tara,GTBR 186,$1199.20,$1499.00,Available,https://nidhiratna.com/products/verdant-grace-the-oxidized-copper-green-tara,2025-06-06
Transcendent Patina: The Oxidized Copper Vajrasattva,VSBR 187,$1199.20,$1499.00,Available,https://nidhiratna.com/products/transcendent-patina-the-oxidized-copper-statue,2025-06-06
"White Tara, the Goddess of Compassion and Healing",WTBR 188,$1199.20,$1499.00,Available,https://nidhiratna.com/products/white-tara-the-goddess-of-compassion-and-healing,2025-06-06
Radiant Vajrasattva Statue,VSBR 189,$1359.20,$1699.00,Available,https://nidhiratna.com/products/radiant-vajrasattva-statue,2025-06-06
White Tara: The Mother of Liberation,WTBR 190,$1359.20,$1699.00,Available,https://nidhiratna.com/products/white-tara-the-mother-of-liberation-statue,2025-06-06
Green Tara: Guardian of Compassion,GTBR 191,$1359.20,$1699.00,Available,https://nidhiratna.com/products/green-tara-guardian-of-compassion-statue,2025-06-06
Illuminated Manjushri Statue,MSBR 192,$1359.20,$1699.00,Available,https://nidhiratna.com/products/lluminated-manjushri-statue,2025-06-06
Guru Rinpoche Statue: Icon of Enlightened Compassion,GRBR 193,$1296.00,$1620.00,Available,https://nidhiratna.com/products/guru-rinpoche-statue-icon-of-enlightened-compassion,2025-06-06
Enchanting Kurukulla Statue,KKBR 194,$1016.00,$1270.00,Available,https://nidhiratna.com/products/enchanting-kurukulla-statue,2025-06-06
Majestic Mahakala Bernagchen Statue,MBBR 195,$844.00,$1055.00,Available,https://nidhiratna.com/products/majestic-mahakala-bernagchen-statue,2025-06-06
Magnificent Singha Mukha Statue,SMBR 196,$1016.00,$1270.00,Available,https://nidhiratna.com/products/magnificent-singha-mukha-statue,2025-06-06
The Timeless Beauty of the Oxidized Green Tara Statue,GTBR 197,$844.00,$1055.00,Available,https://nidhiratna.com/products/the-timeless-beauty-of-the-oxidized-green-tara-statue,2025-06-06
Exquisite Chenrezig Statue,CHBR 198,$844.00,$1055.00,Available,https://nidhiratna.com/products/exquisite-chenrezig-statue,2025-06-06
Crafting Serenity: The Green Tara Statue,GTBR 199,$2664.00,$3330.00,Available,https://nidhiratna.com/products/crafting-serenity-the-green-tara-statue,2025-06-06
Chenrezig: The Bodhisattva of Boundless Compassion,CHBP 143,,,Sold Out,https://nidhiratna.com/products/chenrezig-the-bodhisattva-statue,2025-06-06
Green Tara: The Compassionate Savior,GTBP 144,,,Sold Out,https://nidhiratna.com/products/green-tara-the-compassionate-savior-statue,2025-06-06
Manjushri: The Radiant Dispeller of Ignorance,MSBP 145,,,Sold Out,https://nidhiratna.com/products/manjushri-the-radiant-dispeller-of-ignorance,2025-06-06
Amitayus Buddha: Guardian of Immeasurable Lifespan,ATBP 147,$672.00,$840.00,Available,https://nidhiratna.com/products/amitayus-buddha-statue-budhha,2025-06-06
The Golden Throne: Symbol of Divine Sovereignty,THBP 148,$928.00,$1160.00,Available,https://nidhiratna.com/products/the-golden-throne-symbol-of-divine-sovereign,2025-06-06
