Title,SKU,Sale_Price,Regular_Price,Availability,Link,Date
Buddhist Guru Lotus Statue: Symbol of Compassion and Clarity,GRAO 926,$516.00,$645.00,Available,https://nidhiratna.com/products/buddhist-guru-lotus-statue-padma,2025-06-06
Elegant Guru Lotus Statue: Inspire Your Journey to Enlightenment,GRAO 927,$1084.00,$1355.00,Available,https://nidhiratna.com/products/elegant-guru-lotus-statue-inspire,2025-06-06
Artistic Oxidized Shakyamuni Buddha Statue With Fine Details,BSDD 936,$1400.00,$1750.00,Available,https://nidhiratna.com/products/artistic-oxidized-shakyamuni-buddha-statue,2025-06-06
Chenrezig Statue for Health & Wellness: Compassionate Healing,CHDB 885,$924.00,$1155.00,Available,https://nidhiratna.com/products/chenrezig-statue-for-health-wellness-compassionate,2025-06-06
Stunning Red Buddha: A Unique Representation of Compassion and Courage,BSDD 837,$960.00,$1200.00,Available,https://nidhiratna.com/products/stunning-red-buddha-a-unique-representation,2025-06-06
Dorje Sempa Statue in Gleaming Gold: Guardian of Spiritual Transformation,VSDD 937,$1320.00,$1650.00,Available,https://nidhiratna.com/products/dorje-sempa-statue-in-gleaming-gold-guardian,2025-06-06
Discover the Healing Power of the Amitayus Statue,ATDD 938,$1320.00,$1650.00,Available,https://nidhiratna.com/products/discover-the-healing-power-of-the-amitayus-statue,2025-06-06
Empowering Dolma Buddha Statue: A Guardian for Your Journey,GTAO 941,$1940.00,$2425.00,Available,https://nidhiratna.com/products/empowering-dolma-buddha-statue,2025-06-06
Empowering Vajrapani Buddha Statue for Mindfulness and Focus,VPAO 943,$1040.00,$1300.00,Available,https://nidhiratna.com/products/empowering-vajrapani-buddha-statue,2025-06-06
Fostering Compassion: The Chenrezig Buddha Statue for Your Altar,CHAO 942,$3036.00,$3795.00,Available,https://nidhiratna.com/products/fostering-compassion-the-chenrezig,2025-06-06
Green Tara (Tara Devi) Sculpture: Invoke Divine Compassion,GTAO 944,$1248.00,$1560.00,Available,https://nidhiratna.com/products/green-tara-tara-devi-sculpture,2025-06-06
Guardian of Dharma with Weapons and Fire Aura: Six Arm Mahakala,SAMAO 849,$1040.00,$1300.00,Available,https://nidhiratna.com/products/guardian-of-dharma-with-weapons-and-fire-aura-six-arm-mahakala,2025-06-06
Sacred Full Silver Namtoshe Statue,NTAO 917,$3368.00,$4210.00,Available,https://nidhiratna.com/products/sacred-full-silver-namtoshe-statue,2025-06-06
Fully Oxidized Design for Spiritual Strength: Troma Nagmo Statue,TNMP 749,$360.00,$450.00,Available,https://nidhiratna.com/products/fully-oxidized-design-for-spiritual-strength-troma-nagmo-statue,2025-06-06
Majestic 1000-Armed Avalokiteshvara Sculpture for Spiritual Protection,CHDS 940,,,Sold Out,https://nidhiratna.com/products/majestic-1000-armed-avalokiteshvara-sculpture,2025-06-06
Fearsome Mahakala on Garuda: Protect Your Space with Divine Power,GMDC 945,$1040.00,$1300.00,Available,https://nidhiratna.com/products/fearsome-mahakala-on-garuda-protect,2025-06-06
Vajrapani Bodhisattva Sculpture: Symbol of Unyielding Strength,VPDC 946,$904.00,$1130.00,Available,https://nidhiratna.com/products/vajrapani-bodhisattva-sculpture-symbol,2025-06-06
Wrathful Vajradhaka Sculpture: Symbol of Purification & Enlightenment,VDDC 947,,,Sold Out,https://nidhiratna.com/products/wrathful-vajradhaka-sculpture-symbol,2025-06-06
Authentic Oxidized Shakyamuni Buddha,BSA 948,$1020.00,$1275.00,Available,https://nidhiratna.com/products/authentic-oxidized-shakyamuni-buddha,2025-06-06
Oxidized Milarepa Figure: The Perfect Addition to Your Sacred Space,MA 949,,,Sold Out,https://nidhiratna.com/products/oxidized-milarepa-figure-the-perfect-addition,2025-06-06
Timeless Marpha Statue: Inspiring the Path to Enlightenment,MPA 950,,,Sold Out,https://nidhiratna.com/products/timeless-marpha-statue-inspiring,2025-06-06
Unique Oxidized Gampopa Statue: Guardian of the Kagyu Tradition,GA 951,,,Sold Out,https://nidhiratna.com/products/unique-oxidized-gampopa-statue-guardian,2025-06-06
"The Kagyu Lineage Masters Set: Marpha, Milarepa, and Gampopa Statues",MMGA 954,,,Sold Out,https://nidhiratna.com/products/the-kagyu-lineage-masters-set,2025-06-06
Unique Spiritual Decor for Mindfulness: Shakyamuni Buddha Statue,BSA 952,$1000.00,$1250.00,Available,https://nidhiratna.com/products/unique-spiritual-decor-for-mindfulness-shakyamuni-buddha-statue,2025-06-06
Oxidized Healing Buddha: Symbol of Spiritual and Physical Healing,MBA 953,$904.00,$1130.00,Available,https://nidhiratna.com/products/oxidized-healing-buddha-symbol-of-spiritual,2025-06-06
Primordial Wisdom in Art: Oxidized Samantabhadra with Consort,SBCDD 955,,,Sold Out,https://nidhiratna.com/products/primordial-wisdom-in-art-oxidized,2025-06-06
Oxidized Shakyamuni Buddha Statue | Himalayan Buddhist Statue,BSDD 960,$1120.00,$1400.00,Available,https://nidhiratna.com/products/oxidized-shakyamuni-buddha-statue-himalayan-buddhist-statue,2025-06-06
Discover Peace and Enlightenment with This Oxidized Shakyamuni Buddha,BSDD 959,$1120.00,$1400.00,Available,https://nidhiratna.com/products/discover-peace-and-enlightenment,2025-06-06
Handcrafted Oxidized Siddhartha Sculpture: A Symbol of Inner Calm,BSDD 956,$1160.00,$1450.00,Available,https://nidhiratna.com/products/handcrafted-oxidized-siddhartha-sculpture,2025-06-06
Oxidized Shakyamuni Buddha Statue  A Spiritual Touch for Your Home Decor,BSDD 957,,,Sold Out,https://nidhiratna.com/products/oxidized-shakyamuni-buddha-statue-a-spiritual-touch,2025-06-06
Buddha Figurine: Bring Tranquility & Mindfulness to Your Space,BSDD 958,$957.60,$1197.00,Available,https://nidhiratna.com/products/buddha-figurine-bring-tranquility,2025-06-06
Vajrasattva Statue: Symbol of Purification and Transformation,VSAO 961,$2285.60,$2857.00,Available,https://nidhiratna.com/products/vajrasattva-statue-a-luminous-symbol-of-purification,2025-06-06
Gold Gilded with Turquoise & Coral Accents: Opulent Green Tara Statue,GTDS 939,$4960.00,$6200.00,Available,https://nidhiratna.com/products/gold-gilded-with-turquoise-coral-accents-opulent-green-tara-statue,2025-06-06
Oxidized Copper Shakyamuni Buddha Statue: Perfect for Altars,BSAT 962,$224.00,$280.00,Available,https://nidhiratna.com/products/oxidized-copper-shakyamuni-buddha-statue-perfect-for-altars,2025-06-06
Oxidized Copper Guru Rinpoche Statue with Radiant Gold Face,GRAT 963,$400.00,$500.00,Available,https://nidhiratna.com/products/oxidized-copper-guru-rinpoche-statue-with-radiant-gold-face,2025-06-06
Handcrafted Gold Samantabhadra Statue,SBAO 965,$816.00,$1020.00,Available,https://nidhiratna.com/products/handcrafted-gold-samantabhadra-statue,2025-06-06
Oxidized Copper Green Tara: Spiritual Decor with Gold Face Accent,GTAT 964,$460.00,$575.00,Available,https://nidhiratna.com/products/oxidized-copper-green-tara-spiritual-decor-with-gold-face-accent,2025-06-06
Divine Guru Rinpoche Statue: Gold Gilded with Precious Stones,GRAO 966,$888.00,$1110.00,Available,https://nidhiratna.com/products/divine-guru-rinpoche-statue-gold-gilded-with-precious-stones,2025-06-06
Goddess of Mercy: Chundi Bodhisattva Statue,CAO 967,$2196.00,$2745.00,Available,https://nidhiratna.com/products/goddess-of-mercy-chundi-bodhisattva-statue,2025-06-06
Protector of All Sentient Beings: Tibetan Chenrezig Statue,CHDN 970,$1296.00,$1620.00,Available,https://nidhiratna.com/products/protector-of-all-sentient-beings-tibetan-chenrezig-statue,2025-06-06
Master of Tantric Buddhism: Guru Rinpoche Statue,GRDN 971,$1316.00,$1645.00,Available,https://nidhiratna.com/products/master-of-tantric-buddhism-guru-rinpoche-statue,2025-06-06
Spiritual Mother of All Beings: Mother Green Tara Statue,GTDN 968,$1108.00,$1385.00,Available,https://nidhiratna.com/products/spiritual-mother-of-all-beings-mother-green-tara-statue,2025-06-06
Lotus Born: Tibetan Guru Rinpoche Sculpture,GRDN 969,$656.00,$820.00,Available,https://nidhiratna.com/products/lotus-born-tibetan-guru-rinpoche-sculpture,2025-06-06
Oxidized Shakyamuni Buddha Statue: Perfect for Buddhist Practice,BSAP 977,$896.00,$1120.00,Available,https://nidhiratna.com/products/oxidized-shakyamuni-buddha-statue-perfect-for-buddhist-practice,2025-06-06
Luxurious Spiritual Art for Meditation: Handmade Shakyamuni Buddha,BSAT 979,$2616.00,$3270.00,Available,https://nidhiratna.com/products/luxurious-spiritual-art-for-meditation-handmade-shakyamuni-buddha,2025-06-06
Green Tara Statue: Mother of Compassion & Savior,GTAT 978,$1488.00,$1860.00,Available,https://nidhiratna.com/products/green-tara-statue-mother-of-compassion-savior,2025-06-06
Bodhisattva of Wisdom & Knowledge: Maha Manjushri Statue,MSAP 976,$2256.80,$2821.00,Available,https://nidhiratna.com/products/bodhisattva-of-wisdom-knowledge-maha-manjushri-statue,2025-06-06
Buddhist Deity of Strength & Thunderbolt: Vajrapani Statue,VPAT 980,$2288.00,$2860.00,Available,https://nidhiratna.com/products/buddhist-deity-of-strength-thunderbolt-vajrapani-statue,2025-06-06
Symbol of Impermanence & Transformation: Cittipati Statue,CPDE 973,$896.00,$1120.00,Available,https://nidhiratna.com/products/symbol-of-impermanence-transformation-cittipati-statue,2025-06-06
Lord Ganesh Statue: Symbol of Success & Good Fortune,GDE 972,$616.00,$770.00,Available,https://nidhiratna.com/products/lord-ganesh-statue-symbol-of-success-good-fortune,2025-06-06
Handcrafted Dzambhala with Consort Statue,DZDE 975,$1348.00,$1685.00,Available,https://nidhiratna.com/products/handcrafted-dzambhala-with-consort-statue,2025-06-06
The Oxidation of King Gesar: A Symbolic Exploration,CMDE 974,$800.00,$1000.00,Available,https://nidhiratna.com/products/the-oxidation-of-king-gesar-a-symbolic-exploration,2025-06-06
White Tara Statue for Compassion & Immortality,WTH 987,$1600.00,$2000.00,Available,https://nidhiratna.com/products/white-tara-statue-for-compassion-immortality,2025-06-06
Spiritual White Tara Sculpture,WTH 988,$1520.00,$1900.00,Available,https://nidhiratna.com/products/spiritual-white-tara-sculpture,2025-06-06
Authentic Oxidized Buddha Shakyamuni Statue,BSDD 989,$2064.00,$2580.00,Available,https://nidhiratna.com/products/authentic-oxidized-buddha-shakyamuni-statue,2025-06-06
Ekajati Statue: Emblem of Fearlessness,EAO 984,$600.00,$750.00,Available,https://nidhiratna.com/products/ekajati-statue-emblem-of-fearlessness,2025-06-06
Oxidized Mother Green Tara Statue for Protection,GTDD 990,$1248.00,$1560.00,Available,https://nidhiratna.com/products/oxidized-mother-green-tara-statue-for-protection,2025-06-06
Handmade Full Oxidized Shakyamuni Buddha Statue,BSDD 991,$1144.00,$1430.00,Available,https://nidhiratna.com/products/handmade-full-oxidized-shakyamuni-buddha-statue,2025-06-06
Sacred Dzambhala Statue: Blessings of Prosperity,DZDD 992,$1236.00,$1545.00,Available,https://nidhiratna.com/products/sacred-dzambhala-statue-blessings-of-prosperity,2025-06-06
Handcrafted Virupaksha Statue: Guardian of the Earth,VAO 985,$1016.00,$1270.00,Available,https://nidhiratna.com/products/handcrafted-virupaksha-statue-guardian-of-the-earth,2025-06-06
Goddess of Dawn & Light Protection: Handmade Marichi Statue,MAO 986,$1896.80,$2371.00,Available,https://nidhiratna.com/products/goddess-of-dawn-light-protection-handmade-marichi-statue,2025-06-06
Exquisite Handcrafted Mother Green Tara Statue,GTAT 994,$1425.60,$1782.00,Available,https://nidhiratna.com/products/exquisite-handcrafted-mother-green-tara-statue,2025-06-06
Amitayus Buddha Deity Statue: Blessings of Longevity,ATAT 995,$1425.60,$1782.00,Available,https://nidhiratna.com/products/amitayus-buddha-deity-statue-blessings-of-longevity,2025-06-06
Handcrafted Vajrapani Statue: The Mighty Protector,VPAT 996,$892.00,$1115.00,Available,https://nidhiratna.com/products/handcrafted-vajrapani-statue-the-mighty-protector,2025-06-06
Handmade Dorje Phagmo Statue: The Divine Feminine,DPAP 993,$1224.80,$1531.00,Available,https://nidhiratna.com/products/handmade-dorje-phagmo-statue-the-divine-feminine,2025-06-06
Oxidized Guru Rinpoche Statue: Timeless Artistry for Devotees,GRDD 997,$1672.00,$2090.00,Available,https://nidhiratna.com/products/oxidized-guru-rinpoche-statue-timeless-artistry-for-devotees,2025-06-06
Antique Style Oxidized Green Tara Statue,GTDD 998,$1300.00,$1625.00,Available,https://nidhiratna.com/products/antique-style-oxidized-green-tara-statue,2025-06-06
Oxidized Shakyamuni Buddha Statue: Crafted for Spiritual Serenity,BSDB 999,$864.00,$1080.00,Available,https://nidhiratna.com/products/oxidized-shakyamuni-buddha-statue-crafted-for-spiritual-serenity,2025-06-06
Serene Oxidized Shakyamuni Buddha Statue: Perfect for Meditation,BSDB 1000,$864.00,$1080.00,Available,https://nidhiratna.com/products/serene-oxidized-shakyamuni-buddha-statue-perfect-for-meditation,2025-06-06
Oxidized Hayagriva Statue: Invoke Protection and Fierce Compassion,HGDE 1001,$932.00,$1165.00,Available,https://nidhiratna.com/products/oxidized-hayagriva-statue-invoke-protection-and-fierce-compassion,2025-06-06
Elegant Oxidized Saraswati Statue: Crafted for Wisdom And Artistic Flourishing,SWDE 1002,$737.60,$922.00,Available,https://nidhiratna.com/products/elegant-oxidized-saraswati-statue-crafted-for-wisdom-and-artistic-flourishing,2025-06-06
Handmade Vajrapani Sculpture for Spiritual Defense,VPDE 1003,,,Sold Out,https://nidhiratna.com/products/handmade-vajrapani-sculpture-for-spiritual-defense,2025-06-06
Divine Palden Lhamo Statue,PLDC 1004,$1112.00,$1390.00,Available,https://nidhiratna.com/products/divine-palden-lhamo-statue,2025-06-06
Norlha Namtoshe Wealth God Statue,NTDC 1005,$1036.00,$1295.00,Available,https://nidhiratna.com/products/norlha-namtoshe-wealth-god-statue,2025-06-06
Premium Samantabhadra Statue,SBRS 1006,$1112.00,$1390.00,Available,https://nidhiratna.com/products/premium-samantabhadra-statue,2025-06-06
Goddess Prajnaparamita Buddhist Statue | Icon of Ultimate Wisdom,PPRS 1007,$3596.00,$4495.00,Available,https://nidhiratna.com/products/goddess-prajnaparamita-buddhist-statue-icon-of-ultimate-wisdom,2025-06-06
Ancient 19 Inch Shakyamuni Buddha with Halo,BSAO 1014,$1776.80,$2221.00,Available,https://nidhiratna.com/products/ancient-19-inch-shakyamuni-buddha-with-halo,2025-06-06
13 Inch Gold Gilded Buddha Statue for Spiritual Practice,BSAT 1010,$1336.80,$1671.00,Available,https://nidhiratna.com/products/13-inch-gold-gilded-buddha-statue-for-spiritual-practice,2025-06-06
Nepalese 13.5 Inch Shakyamuni Buddha Statue: Oxidized Copper with Silver Plated,BSAT 1011,$560.00,$700.00,Available,https://nidhiratna.com/products/nepalese-13-5-inch-shakyamuni-buddha-statue-oxidized-copper-with-silver-plated,2025-06-06
8 Inch Shakyamuni Buddha Statue on Lotus,BSAT 1012,$586.40,$733.00,Available,https://nidhiratna.com/products/8-inch-shakyamuni-buddha-statue-on-lotus,2025-06-06
Handcrafted 13 Inch Shakyamuni Buddha Statue in Oxidized Copper,BSAT 1013,$736.80,$921.00,Available,https://nidhiratna.com/products/handcrafted-13-inch-shakyamuni-buddha-statue-in-oxidized-copper,2025-06-06
Elegant 12.5 Inch Buddha Shakyamuni for Divine Decor,BSDB 1015,$1384.00,$1730.00,Available,https://nidhiratna.com/products/elegant-12-5-inch-buddha-shakyamuni-for-divine-decor,2025-06-06
Sacred 8 Inch Gold Shakyamuni Buddha Statue,BSDB 1016,$709.60,$887.00,Available,https://nidhiratna.com/products/sacred-8-inch-gold-shakyamuni-buddha-statue,2025-06-06
Tibetan Milarepa Statue for Buddhist Practitioners,MDB 1017,$1840.80,$2301.00,Available,https://nidhiratna.com/products/tibetan-milarepa-statue-for-buddhist-practitioners,2025-06-06
Meditative Oxidized Samantabhadra Statue,SBDB 1018,$852.00,$1065.00,Available,https://nidhiratna.com/products/meditative-oxidized-samantabhadra-statue,2025-06-06
Handmade Mother Green Tara Statue: Embodying Compassion,GTG 1008,$1840.00,$2300.00,Available,https://nidhiratna.com/products/handmade-mother-green-tara-statue-embodying-compassion,2025-06-06
Artisan Handcrafted Mother Green Tara Statue,GTG 1009,$2320.00,$2900.00,Available,https://nidhiratna.com/products/artisan-handcrafted-mother-green-tara-statue,2025-06-06
Premium 12.8 Inch Shakyamuni Buddha Statue,BSH 981,$1488.00,$1860.00,Available,https://nidhiratna.com/products/premium-12-8-inch-shakyamuni-buddha-statue,2025-06-06
Exquisite Shakyamuni Buddha Statue: Timeless Buddhist Art,BSH 982,$1412.80,$1766.00,Available,https://nidhiratna.com/products/exquisite-shakyamuni-buddha-statue-timeless-buddhist-art,2025-06-06
Large Buddha Shakyamuni Statue with Halo: Spiritual Masterpiece,BSH 983,$1440.00,$1800.00,Available,https://nidhiratna.com/products/large-buddha-shakyamuni-statue-with-halo-spiritual-masterpiece,2025-06-06
Sacred Green Tara Statue: Symbol of Swift Compassion,GTDD 1019,,,Sold Out,https://nidhiratna.com/products/sacred-green-tara-statue-symbol-of-swift-compassion,2025-06-06
Oxidized Guru Norla Statue:  Attract Wealth and Blessings to Your Life,GRDD 1020,$2496.00,$3120.00,Available,https://nidhiratna.com/products/oxidized-guru-norla-statue-attract-wealth-and-blessings-to-your-life,2025-06-06
Green Dzambhala with Consort Statue:  Symbol of Prosperity and Harmony,DZDE 1022,$1348.00,$1685.00,Available,https://nidhiratna.com/products/green-dzambhala-with-consort-statue-symbol-of-prosperity-and-harmony,2025-06-06
Sacred 15.7 Inch Oxidized Vajrasattva Statue,VSRS 1033,$2856.00,$3570.00,Available,https://nidhiratna.com/products/sacred-15-7-inch-oxidized-vajrasattva-statue,2025-06-06
Artistic 12.8 Inch Oxidized Green Tara Statue,GTDE 1021,$880.00,$1100.00,Available,https://nidhiratna.com/products/artistic-12-8-inch-oxidized-green-tara-statue,2025-06-06
Oxidized 8.8 Inch Kshitigarbha Buddha Statue,KSDE 1023,$480.00,$600.00,Available,https://nidhiratna.com/products/oxidized-8-8-inch-kshitigarbha-buddha-statue,2025-06-06
Oxidized Akashgarbha Statue : Keeper of Wisdom and Space,AKDE 1024,$480.00,$600.00,Available,https://nidhiratna.com/products/oxidized-akashgarbha-statue-keeper-of-wisdom-and-space,2025-06-06
Handmade 8.8 Inch Four-Armed Chenrezig Buddha Statue,CHDE 1025,$480.00,$600.00,Available,https://nidhiratna.com/products/handmade-8-8-inch-four-armed-chenrezig-buddha-statue,2025-06-06
Artisan-Made Karmapa Statue for Practitioners,KRS 1029,$1200.00,$1500.00,Available,https://nidhiratna.com/products/artisan-made-karmapa-statue-for-practitioners,2025-06-06
9.6 Inch Oxidized Green Tara: Goddess of Protection,GTRS 1030,$1676.00,$2095.00,Available,https://nidhiratna.com/products/9-6-inch-oxidized-green-tara-goddess-of-protection,2025-06-06
Great Master Tsongkhapa Statue: Ideal for Meditation,TKRS 1031,$1067.20,$1334.00,Available,https://nidhiratna.com/products/great-master-tsongkhapa-statue-ideal-for-meditation,2025-06-06
9.66 Inch Dorje Sempa Statue for Tibetan Spirituality,VSRS 1032,$2000.00,$2500.00,Available,https://nidhiratna.com/products/9-66-inch-dorje-sempa-statue-for-tibetan-spirituality,2025-06-06
21.2 Inch Guru Rinpoche Statue | Master of Vajrayana Buddhism,GRAT 1035,,,Sold Out,https://nidhiratna.com/products/21-2-inch-guru-rinpoche-statue-master-of-vajrayana-buddhism,2025-06-06
Gold-Gilded Vajrapani Statue:  Symbol of Strength in Tibetan Buddhism,VPAT 1036,$736.80,$921.00,Available,https://nidhiratna.com/products/gold-gilded-vajrapani-statue-symbol-of-strength-in-tibetan-buddhism,2025-06-06
Two-Armed Chenrezig: Guardian of Compassion,CHG 1028,$1832.00,$2290.00,Available,https://nidhiratna.com/products/two-armed-chenrezig-guardian-of-compassion,2025-06-06
Six-Armed Mahakala Deity Statue | Fierce Protector,SAMAO 1034,$1713.60,$2142.00,Available,https://nidhiratna.com/products/six-armed-mahakala-deity-statue-fierece-protector,2025-06-06
Sacred Mother Green Tara Statue in Meditative Pose,GTDD 1038,$1352.00,$1690.00,Available,https://nidhiratna.com/products/sacred-mother-green-tara-statue-in-meditative-pose,2025-06-06
Enlightened Yogi Virupa Statue,VDD 1037,$1292.80,$1616.00,Available,https://nidhiratna.com/products/enlightened-yogi-virupa-statue,2025-06-06
Unique Mitrugpa Statue: Tibetan Cultural Heritage,MGD 1039,$2240.00,$2800.00,Available,https://nidhiratna.com/products/unique-mitrugpa-statue-tibetan-cultural-heritage,2025-06-06
Consecration Charge,consecration-charge,$75.00,$75.00,Available,https://nidhiratna.com/products/consecration-charge,2025-06-06
14 Inch Authentic Manjushri Statue,MSH 1042,$1412.80,$1766.00,Available,https://nidhiratna.com/products/14-inch-authentic-manjushri-statue,2025-06-06
Glistening Silver Shakyamuni Buddha Statue,BSH 1043,$932.00,$1165.00,Available,https://nidhiratna.com/products/glistening-silver-shakyamuni-buddha-statue,2025-06-06
13.5 Inch Matte Mother Green Tara Sculpture,GTH 1044,$1280.00,$1600.00,Available,https://nidhiratna.com/products/13-5-inch-matte-mother-green-tara-sculpture,2025-06-06
Regal Mitrugpa on Throne Statue | A Majestic Representation of Compassion,MGD 1040,$4800.00,$6000.00,Available,https://nidhiratna.com/products/regal-mitrugpa-on-throne-statue-a-majestic-representation-of-compassion,2025-06-06
Handmade Majestic 16.5 Inch Guru Rinpoche Statue,GRG 1026,$2720.00,$3400.00,Available,https://nidhiratna.com/products/handmade-majestic-16-5-inch-guru-rinpoche-statue,2025-06-06
Masterpiece 15.5 Inch Guru Rinpoche Statue: A Spiritual Treasure,GRG 1027,,,Sold Out,https://nidhiratna.com/products/masterpiece-15-5-inch-guru-rinpoche-statue-a-spiritual-treasure,2025-06-06
18 Inch Oxidized Padmasambhava Sculpture,GRDD 1046,$2054.40,$2568.00,Available,https://nidhiratna.com/products/18-inch-oxidized-padmasambhava-sculpture,2025-06-06
Tibetan Mother Dolma Statue in Oxidized Copper,GTDD 1047,$596.00,$745.00,Available,https://nidhiratna.com/products/tibetan-mother-dolma-statue-in-oxidized-copper,2025-06-06
18.7 Inch Serene White Tara Statue,WTAT 1045,$1292.80,$1616.00,Available,https://nidhiratna.com/products/18-7-inch-serene-white-tara-statue,2025-06-06
Tibetan Dorje Lekpa Statue for Peace and Protection,DLDE 1048,$920.00,$1150.00,Available,https://nidhiratna.com/products/tibetan-dorje-lekpa-statue-for-peace-and-protection,2025-06-06
Wrathful Vajrapani Protector Statue,VPDE 1049,$920.00,$1150.00,Available,https://nidhiratna.com/products/wrathful-vajrapani-protector-statue,2025-06-06
Timeless Buddha Statue of Shakyamuni,BSBN 1052,$1040.00,$1300.00,Available,https://nidhiratna.com/products/timeless-buddha-statue-of-shakyamuni,2025-06-06
Dorje Drollo Buddhist Statue in Oxidized Copper,DDDE 1051,$936.00,$1170.00,Available,https://nidhiratna.com/products/dorje-drollo-buddhist-statue-in-oxidized-copper,2025-06-06
Two-Armed Chenresig Statue: Compassionate Deity on Lion,CHDE 1050,$1120.00,$1400.00,Available,https://nidhiratna.com/products/two-armed-chenresig-statue-compassionate-deity-on-lion,2025-06-06
The Awakened One Shakyamuni Buddha Statue: Limited Edition,BSDG 1053,$1400.00,$1750.00,Available,https://nidhiratna.com/products/the-awakened-one-shakyamuni-buddha-statue-limited-edition,2025-06-06
The Blissful One Amitabha Buddha Statue: Limited Edition,ABDG 1054,$1386.40,$1733.00,Available,https://nidhiratna.com/products/the-blissful-one-amitabha-buddha-statue-limited-edition,2025-06-06
The Healer One Medicine Buddha Statue: Limited Edition,MBDG 1055,$1386.40,$1733.00,Available,https://nidhiratna.com/products/the-healer-one-medicine-buddha-statue-limited-edition,2025-06-06
Exquisite Guru Norlha Statue: The Prosperity Deity,GRDG 1056,$1320.00,$1650.00,Available,https://nidhiratna.com/products/exquisite-guru-norlha-statue-the-prosperity-deity,2025-06-06
Three Budha Statue Set: Limited Edition,TBSDG 1057,$3999.20,$4999.00,Available,https://nidhiratna.com/products/three-budha-statue-set-limited-edition,2025-06-06
Oxidized Dzambhala Statue: Symbol of Spiritual Wealth,DZG 1058,$661.60,$827.00,Available,https://nidhiratna.com/products/oxidized-dzambhala-statue-symbol-of-spiritual-wealth,2025-06-06
Fine Gold plated Shakyamuni Buddha Statue: Exclusive Collection for Practitioners,BSG 1059,$887.20,$1109.00,Available,https://nidhiratna.com/products/fine-gold-plated-shakyamuni-buddha-statue-exclusive-collection-for-practitioners,2025-06-06
Fine Gold Plated Amitabha Buddha Statue: Exclusive Collection for Practitioners,ABG 1060,$887.20,$1109.00,Available,https://nidhiratna.com/products/fine-gold-plated-amitabha-buddha-statue-exclusive-collection-for-practitioners,2025-06-06
Fine Gold Plated Medicine Buddha Statue: Exclusive Collection for Practitioners,MBG 1061,$887.20,$1109.00,Available,https://nidhiratna.com/products/fine-gold-plated-medicine-buddha-statue-exclusive-collection-for-practitioners,2025-06-06
Divine Goddess White Tara Statue,WTH 1070,$2256.00,$2820.00,Available,https://nidhiratna.com/products/divine-goddess-white-tara-statue,2025-06-06
Masterpiece Shakyamuni Buddha Statue: Sacred Trio Set,BSG 1066,$2400.00,$3000.00,Available,https://nidhiratna.com/products/masterpiece-shakyamuni-buddha-statue-sacred-trio-set,2025-06-06
Masterpiece Namo Amitabha Buddha Statue,ABG 1067,$2400.00,$3000.00,Available,https://nidhiratna.com/products/masterpiece-namo-amitabha-buddha-statue,2025-06-06
Masterpiece Medicine Buddha Statue: Sacred Trio Set,MBG 1068,$2400.00,$3000.00,Available,https://nidhiratna.com/products/masterpiece-medicine-buddha-statue-sacred-trio-set,2025-06-06
Antique Finish Shakyamuni Buddha Statue For Serenity and Focus,BSDB 1071,,,Sold Out,https://nidhiratna.com/products/antique-finish-shakyamuni-buddha-statue-for-serenity-and-focus,2025-06-06
11.4 Inch Dzambhala Wealth Deity Statue,DZAB 1072,$1112.00,$1390.00,Available,https://nidhiratna.com/products/11-4-inch-dzambhala-wealth-deity-statue,2025-06-06
Sacred Handmade Vajrapani Statue:  Ideal for Empowering Your Space,VPDB 1073,,,Sold Out,https://nidhiratna.com/products/sacred-handmade-vajrapani-statue-ideal-for-empowering-your-space,2025-06-06
Antique Design Amitabha Buddha Statue For Tranquility,ABDB 1074,$1888.00,$2360.00,Available,https://nidhiratna.com/products/antique-design-amitabha-buddha-statue-for-tranquility,2025-06-06
