Title,SKU,Sale_Price,Regular_Price,Availability,Link,Date
Green Tara Statue: Protection and Peace,GTA 1,,,Sold Out,https://nidhiratna.com/products/green-tara-statue-gold,06/01/2025
Radiant Shakyamuni Buddha Sculpture,BSA 2,,,Sold Out,https://nidhiratna.com/products/buddha-shakyamuni-gold,06/01/2025
Gold Gilded Guru Rinpoche Statue,GRA 3,$852.00,"$1,065.00",Available,https://nidhiratna.com/products/gold-gilded-guru-rinpoche-statue-1,06/01/2025
Bodhisattva Amitayus,ATA 4,$832.00,"$1,040.00",Available,https://nidhiratna.com/products/amitayus-buddha-sculpture,06/01/2025
Traditional Shakyamuni Buddha,5 BSA,,,Sold Out,https://nidhiratna.com/products/shakyamuni-buddha-siddhartha-gautam,06/01/2025
Shakyamuni Buddha Statue,6 BSA,"$2,180.00","$2,725.00",Available,https://nidhiratna.com/products/shakyamuni-buddha-statue-3,06/01/2025
Divine Mother Tara: Protection & Swift Action,7 GTA,,,Sold Out,https://nidhiratna.com/products/divine-mother-tara,06/01/2025
White Tara Golden Statue: Compassion and Wisdom,WTA 8,"$1,256.00","$1,570.00",Available,https://nidhiratna.com/products/white-tara-tibetan-deity-tara,06/01/2025
Dzambhala : The Wealth Deity,DZA 9,"$1,088.00","$1,360.00",Available,https://nidhiratna.com/products/dzambhala-the-wealth-deity,06/01/2025
Guru Rinpoche Statue Lotus Born Master,GRA 10,"$1,732.00","$2,165.00",Available,https://nidhiratna.com/products/guru-rinpoche-lotus-master-padmasambhav,06/01/2025
Namgyalma Mantra Statue : The Divine Protector of Longevity and Purification,NGA 11,"$1,336.00","$1,670.00",Available,https://nidhiratna.com/products/protector-of-longevity-and-purification-namgyalma,06/01/2025
Kalachakra Deity Statue: Tibetan Buddhist  Sculpture,12 KCA,"$1,552.00","$1,940.00",Available,https://nidhiratna.com/products/kalachakra-statue-mandala,06/01/2025
Namgyalma (Ushnisa Vijaya) Sculpture | A Divine Statue of Peace and Healing,NGA 13,,,Sold Out,https://nidhiratna.com/products/namgyalma-nga-ushnisavijaya-tibetan-deity,06/01/2025
Vajrasattva Statue: The Glorious Bodhisattva of Purification,VSA 14,,,Sold Out,https://nidhiratna.com/products/vajrasattva-bodhisattva-purifier,06/01/2025
Manjushri: Guardian of Knowledge and Clarity,MSA 15,,,Sold Out,https://nidhiratna.com/products/manjushri-manjushree-bodhisattva-statue,06/01/2025
White Tara: The Compassionate Mother of Longevity and Healing,WTA 16,,,Sold Out,https://nidhiratna.com/products/white-tara-buddha-female,06/01/2025
The Power of Dzambhala: Invoking Wealth and Prosperity,18 DZA,,,Sold Out,https://nidhiratna.com/products/dzambhala-wealth-deity-kuber-statue,06/01/2025
Kshitigarbha Statue | Guardian of Souls,KGA 19,,,Sold Out,https://nidhiratna.com/products/kshitigarbha-gaurdian-of-sould-bodhisattva,06/01/2025
The Golden Buddhist Statue : Amitabha Buddha,ABA 21,"$1,016.00","$1,270.00",Available,https://nidhiratna.com/products/amitabha-buddha-compassion-buddha,06/01/2025
Unlocking the Power of Vajrapani: Protector and Guide in Buddhist Tradition,20 VPA,"$1,344.00","$1,680.00",Available,https://nidhiratna.com/products/vajrapani-deityofpower-bodhisattva,06/01/2025
Vajradhara: The Primordial Buddha of Tantric Buddhism,VDA 22,$764.00,$955.00,Available,https://nidhiratna.com/products/vajradhara-bodhisattva-staute-sculpture,06/01/2025
Kshitigarbha | Buddhist Bodhisattva Statue,23 KGA,$760.00,$950.00,Available,https://nidhiratna.com/products/kshitigarbha-bodhisattva-statue-sculpture,06/01/2025
Green Tara: The Compassionate Savior in Tibetan Buddhism,GTA 24,,,Sold Out,https://nidhiratna.com/products/green-tara-mothertara-tara-statue,06/01/2025
Vajrapani : The Symbolism and Significance of the Thunderbolt-Bearing,VPA 25,,,Sold Out,https://nidhiratna.com/products/symbolism-and-significance-of-the-thunderbolt,06/01/2025
Amitayus Buddha: Bestower of Long Life and Enlightenment,ATA 26,,,Sold Out,https://nidhiratna.com/products/26-amitayus-buddha-statue,06/01/2025
The Radiant Glory of Amitabha Buddha,27 ABA,$360.00,$450.00,Available,https://nidhiratna.com/products/27-amitabha-buddha-statue,06/01/2025
Empowerment through Vajrapani: Embodying Strength and Resilience in Buddhist Practice,28 VPA,,,Sold Out,https://nidhiratna.com/products/28-vajrapani-bodhisattva-statue,06/01/2025
Amitabha: The Shining Protector,29 ABA,$956.00,"$1,195.00",Available,https://nidhiratna.com/products/amitabha-buddha-statue-amitabha,06/01/2025
Dukar Statue: Spiritual Strength,DKA 30,$716.00,$895.00,Available,https://nidhiratna.com/products/dukar-statue-spiritual-strength-statues,06/01/2025
"Buddha Sakyamuni Statue - Silver Plated Body, Gold Face, Handcrafted",31 BSA,,,Sold Out,https://nidhiratna.com/products/buddha-shakyamuni-sliver-plated-body,06/01/2025
Transcendence in Gold : The Buddha Sculpture Crafted in 24K Splendor,32 BSA,$332.00,$415.00,Available,https://nidhiratna.com/products/uddha-sculpture-crafted-in-24k-splendor-statue,06/01/2025
Green Tara: Syamatara Buddhist Sculpture,GTA 17,,,Sold Out,https://nidhiratna.com/products/green-tara-sayamatara-mothertara-statue,06/01/2025
Four-Armed Chenrezig Statue | 24K Gold Gilded and Oxidized Copper,33 CHA,,,Sold Out,https://nidhiratna.com/products/33-chenresig-four-armed-chenrezig-statue-sculpture,06/01/2025
Amitayus Buddha : The Luminous Buddha of Endless Life,34 ATA,,,Sold Out,https://nidhiratna.com/products/33-amitayus-buddha-statue,06/01/2025
Longchenpa | Longchen Rabjam Oxidized Copper Statue,35 LGA,,,Sold Out,https://nidhiratna.com/products/longchenpa-longchen-rabjam,06/01/2025
Buddha Shakyamuni | Tibetan Buddhist Statue,36 BSA,,,Sold Out,https://nidhiratna.com/products/36-buddha-shakyamuni-gautam-buddha-statue,06/01/2025
Amitabha: Light of Compassion and Wisdom,ABA 37,"$1,472.00","$1,840.00",Available,https://nidhiratna.com/products/37-amitabha-buddha-wisdom-compassion-statue,06/01/2025
Enlightenment Under the Bodhi Tree : Sakyamuni Buddha,38 BSA,,,Sold Out,https://nidhiratna.com/products/enlightenment-sakyamuni-buddha-gautam-buddha-statue,06/01/2025
1000 Armed Chenrezig  Statue : Transformation and Liberation,39 CHA,$792.00,$990.00,Available,https://nidhiratna.com/products/1000-chenresig-statue-sculpture,06/01/2025
Chenrezig: Buddhist Avalokiteshvara Statue Glided with 24K Gold,40 CHR,,,Sold Out,https://nidhiratna.com/products/40-chenresig-avalokiteshvara-statue,06/01/2025
Manjushri: The Enlightened Sage,41 MSR,,,Sold Out,https://nidhiratna.com/products/41-manjushri-bodhisattva-statue,06/01/2025
Shakyamuni Buddha Statue | Glided with 24K Gold,42 BSR,"$1,240.00","$1,550.00",Available,https://nidhiratna.com/products/42-buddha-shakyamuni-gautama-buddha-statue,06/01/2025
Vajrasattva : The Deity of Purification,43 VSR,,,Sold Out,https://nidhiratna.com/products/43-vajrasattva-bodhisattva-statue,06/01/2025
Golden Enlightenment: The Buddha in 24K Gold,44 BSR,,,Sold Out,https://nidhiratna.com/products/44-shakyamuni-gautama-buddha-statue,06/01/2025
Vajrasattva : The Purification and Restoration of Vows,45 VSR,,,Sold Out,https://nidhiratna.com/products/vajrasattva-deity-of-purification-statue-dorje-sempa,06/01/2025
Beautiful Handcrafted Buddha Sakyamuni Statue,46 BSR,$904.00,"$1,130.00",Available,https://nidhiratna.com/products/buddha-shakyamuni-buddha-statue,06/01/2025
Amitabha Buddha : The Infinite Shining One,ABR 47,$904.00,"$1,130.00",Available,https://nidhiratna.com/products/47-amitabha-buddha-statue-buddhist-statue,06/01/2025
Siddhartha Gautama Statue | Beautiful Handcrafted Buddhist Statue,48 BSR,"$1,072.00","$1,340.00",Available,https://nidhiratna.com/products/handcrafted-buddhist-statue-siddhartha-gautama,06/01/2025
Manjushri : The Bodhisattva of Wisdom,49 MSR,,,Sold Out,https://nidhiratna.com/products/49-manjushri-deity-of-wisdom-bodhisattva,06/01/2025
Golden Radiance and Timeless Wisdom: The Medicine Buddha in Gold,52 MBR,,,Sold Out,https://nidhiratna.com/products/medicine-buddha-in-gold-statue,06/01/2025
White Tara : The Mother of Compassion,50 WTR,$820.00,"$1,025.00",Available,https://nidhiratna.com/products/50-white-tara-mother-tara-statue,06/01/2025
Shakyamuni Buddha : Bask in the Brilliance of Spiritual Illumination,53 BSR,"$1,324.00","$1,655.00",Available,https://nidhiratna.com/products/shakyamuni-buddha-statue-gautamabuddha,06/01/2025
Amitabha Buddha : The Buddha of the Western Pure Land,ABR 54,,,Sold Out,https://nidhiratna.com/products/amitabha-buddha-statue-buddha,06/01/2025
Tsongkhapa Triad: Three Unique Expressions,55 TKR,,,Sold Out,https://nidhiratna.com/products/tsongkhapa-triad-three-unique-expressions,06/01/2025
Mahakala Bernagchen: Guardian of the Sacred Path,MKBR 56,$820.00,"$1,025.00",Available,https://nidhiratna.com/products/mahakala-bernagchen-guardian-of-the-sacred-path,06/01/2025
Radiant Majesty: The Crowned Shakyamuni Buddha in Gold,57 CBSR,$820.00,"$1,025.00",Available,https://nidhiratna.com/products/crowned-buddha-shakyamuni-buddha-statue,06/01/2025
Medicine Buddha : The Healing Radiance,58 MBR,,,Sold Out,https://nidhiratna.com/products/medicine-buddha-healing-buddha-1,06/01/2025
"Triumphant Grace: Namgyalma, the Three-Faced Goddess",59 NGR,,,Sold Out,https://nidhiratna.com/products/namgyalma-the-three-faced-goddess-statuess,06/01/2025
Divine Contemplation: The Golden Milarepa Statue,60 MR,$660.00,$825.00,Available,https://nidhiratna.com/products/the-golden-milarepa-statue-in-buddhist,06/01/2025
Marpha's Essence: Unveiling Lhodak Marpa Choski Lodos,61 MR,,,Sold Out,https://nidhiratna.com/products/marpa-buddhist-master-statue-guru-statue,06/01/2025
The Radiant Wisdom: Exploring the Teachings of Gampopa,62 GPR,,,Sold Out,https://nidhiratna.com/products/the-teachings-of-gampopa,06/01/2025
Prosperity's Guardian: The Dzambhala Statue,63 DZR,$488.00,$610.00,Available,https://nidhiratna.com/products/guardian-the-dzambhala-statue,06/01/2025
Manjushri Bodhisattva | Embodiment of Enlightened Wisdom,64 MSR,,,Sold Out,https://nidhiratna.com/products/manjushri-bodhisattva-embodiment-of-enlightened-wisdom,06/01/2025
Vajrasattva : Embodiment of Purity,65 VSR,"$2,400.00","$3,000.00",Available,https://nidhiratna.com/products/vajrasattva-purity-deity-statue,06/01/2025
Sakya Mahakala : Guardian of the Sakya Lineage,66 SMR,$652.00,$815.00,Available,https://nidhiratna.com/products/sakya-mahakala-black-protector-statue,06/01/2025
Beyond Vision: The Third Eye of Indra and Cosmic Wisdom,67 INR,"$1,188.00","$1,485.00",Available,https://nidhiratna.com/products/the-third-eye-of-indra-and-cosmic-wisdom-statue,06/01/2025
The Healing Buddha: Bhaisajyaguru's Vows and Powers,68 MBR,$916.00,"$1,145.00",Available,https://nidhiratna.com/products/the-healing-buddha-bhaisajyagurus-statue,06/01/2025
White Dzambhala :The Prosperity Guardian atop the Dragon,69 WDZR,$648.00,$810.00,Available,https://nidhiratna.com/products/69-white-dzambhala-kuber-statue,06/01/2025
Compassion Embodied: The Seated Chenrezig Statue,70 CHR,"$2,612.00","$3,265.00",Available,https://nidhiratna.com/products/chenresig-oxidized-chenrezig,06/01/2025
Enlightened Presence: The Karmapa Statue in Tibetan Buddhism,71 KPR,$744.00,$930.00,Available,https://nidhiratna.com/products/the-karmapa-statue-in-tibetan-buddhism,06/01/2025
The Fasting Buddha: An Emblem of Perseverance and Balance,72 BSR,$672.00,$840.00,Available,https://nidhiratna.com/products/fasting-buddha-shakyamuni-buddha-statue,06/01/2025
Radiant Wisdom: Understanding the Spectrum of Guru Rinpoche's,73 GRR,"$1,272.00","$1,590.00",Available,https://nidhiratna.com/products/understanding-the-spectrum-of-guru-rinpoches,06/01/2025
The Bodhi Tree's Guardian: Shakyamuni Buddha's Compassionate Light,74 BSBP,,,Sold Out,https://nidhiratna.com/products/bodhi-trees-guardian-shakyamuni-buddhas,06/01/2025
Sacred Medicine: The Medicine Buddha's Journey to Enlightenment,75 MBBP,,,Sold Out,https://nidhiratna.com/products/medicine-buddha-sacred-medicine-statue,06/01/2025
Eternal Light: Exploring the Amitabha Buddha Statue,ABBP 76,"$2,400.00","$3,000.00",Available,https://nidhiratna.com/products/amitabha-buddhha-statue-beacon-of-compassion,06/01/2025
Emerald Grace: The Green Tara Statue,77 GTBP,,,Sold Out,https://nidhiratna.com/products/green-tara-ststue-emerald-grace,06/01/2025
Vajrakilaya: The Thunderbolt of Enlightenment,78 VKBP,"$1,588.00","$1,985.00",Available,https://nidhiratna.com/products/78-vajrakilaya-thunderbolt-statue,06/01/2025
Guru Rinpoche: The Padmasambhava Teachings,79 GRBP,$748.00,$935.00,Available,https://nidhiratna.com/products/guru-rinpoche-padmasambhava-statue-in-gold,06/01/2025
Trilogy of Enlightenment: The Three Buddha Set,80 TBSBP,,,Sold Out,https://nidhiratna.com/products/trilogy-of-enlightenment-the-three-buddha-set-statue,06/01/2025
Dzambhala Statue: Manifesting Wealth and Prosperity,81 DZBP,"$1,272.00","$1,590.00",Available,https://nidhiratna.com/products/dzambhala-statue-kuber-wealth-deity,06/01/2025
Purifying Light: The Vajrasattva Statue,82 VSBP,$760.00,$950.00,Available,https://nidhiratna.com/products/purifying-light-the-vajrasattva-statue,06/01/2025
Regal Serenity: The Crowned Shakyamuni Buddha,CBSBP 83,$880.00,"$1,100.00",Available,https://nidhiratna.com/products/regal-serenity-the-crowned-shakyamuni-buddha,06/01/2025
"The Tsongkhapa Triad: Embodiments of Wisdom, Compassion & Enlightenment",84 TKBP,"$3,788.00","$4,735.00",Available,https://nidhiratna.com/products/the-tsongkhapa-triad-enlightenment,06/01/2025
Arya Tara Green Tara Statue | Himalayan Spiritual Art,85 GTBP,"$5,680.00","$7,100.00",Available,https://nidhiratna.com/products/arya-tara-green-tara-statue-himalayan-spiritual-art,06/01/2025
Green Tara: The Compassionate Guardian,86 GTBP,,,Sold Out,https://nidhiratna.com/products/green-tara-statue-mother-tara,06/01/2025
Divine Manjushri Statue,MSBP 90,"$8,240.00","$10,300.00",Available,https://nidhiratna.com/products/divine-manjushri-statue,06/01/2025
The Mighty Garuda: Mythical Bird of Legend,93 MGDR,$108.00,$135.00,Available,https://nidhiratna.com/products/the-mighty-garuda-mythical-bird,06/01/2025
Vajrayogini: The Divine Consort of Enlightenment,94 MVYR,,,Sold Out,https://nidhiratna.com/products/vajrayogini-the-divine-consort-statue,06/01/2025
Chakrasamvara: The Embodiment of Bliss and Emptiness,95 MCKR,$332.00,$415.00,Available,https://nidhiratna.com/products/chakrasamvara-the-embodiment-of-bliss-and-emptiness,06/01/2025
Chenrezig Bodhisattva Statue,CHBP 96,$924.00,"$1,155.00",Available,https://nidhiratna.com/products/chenrezig-bodhisattva-statue,06/01/2025
The Thousand- Armed Chenrezig: Manifestation of Compassionate Wisdom,CHBP 97,"$2,344.00","$2,930.00",Available,https://nidhiratna.com/products/the-thousand-armed-chenrezig-statue,06/01/2025
White Tara: Goddess of Compassion and Longevity,WTBP 98,$916.00,"$1,145.00",Available,https://nidhiratna.com/products/white-tara-goddess-of-compassion-and-longevity,06/01/2025
Vajrasattva: Purification and Enlightenment,VSBP 99,,,Sold Out,https://nidhiratna.com/products/vajrasattva-purification-and-enlightenment,06/01/2025
Amitayus: Fountain of Infinite Life and Boundless Compassion,100 ATBP,$928.00,"$1,160.00",Available,https://nidhiratna.com/products/fountain-of-infinite-life-statues,06/01/2025
Radiant Vajrayogini Statue,91 MVYR,$316.00,$395.00,Available,https://nidhiratna.com/products/radiant-vajrayogini-statue,06/01/2025
Majestic Dorje Drolo Statue,MDDR 92,,,Sold Out,https://nidhiratna.com/products/majestic-dorje-drolo-statue,06/01/2025
Green Tara: Goddess of Compassion and Swift Protection,GTBP 101,,,Sold Out,https://nidhiratna.com/products/green-tara-statue-gold-statues-in-buddhist,06/01/2025
Amitabha Buddha: Radiant Symbol of Infinite Light & Boundless Compassion,102 ABBP,$844.00,"$1,055.00",Available,https://nidhiratna.com/products/infinite-light-and-boundless-compassion-amitabha-buddha,06/01/2025
White Tara: Embodiment of Serenity and Wisdom,WTBP 103,$756.00,$945.00,Available,https://nidhiratna.com/products/white-tara-embodiment-of-serenity-and-wisdom,06/01/2025
Buddha Sakyamuni: Enlightened One of the Sakya,BSBP 104,$844.00,"$1,055.00",Available,https://nidhiratna.com/products/buddha-sakyamuni-enlightened-statue,06/01/2025
Green Tara: Goddess of Compassion,GTBP 124,,,Sold Out,https://nidhiratna.com/products/green-tara-goddess-of-compassion-statue,06/01/2025
Saraswati: Goddess of Knowledge and Wisdom,SWBP 125,"$1,444.00","$1,805.00",Available,https://nidhiratna.com/products/saraswati-goddess-of-knowledge-and-wisdom,06/01/2025
Medicine Buddha: Healing Light of Compassionate Wisdom,MBBP 105,$756.00,$945.00,Available,https://nidhiratna.com/products/medicine-buddha-healing-buddha-statue,06/01/2025
White Tara Goddess Statue,WTBP 106,$588.00,$735.00,Available,https://nidhiratna.com/products/white-tara-goddess-statue,06/01/2025
Mitrugpa: The Imperturbable Buddha,MGBP 107,,,Sold Out,https://nidhiratna.com/products/mitrugpa-the-imperturbable-buddha,06/01/2025
White Tara: The Embodiment of Wisdom and Compassion,WTA 88,"$2,428.00","$3,035.00",Available,https://nidhiratna.com/products/white-tara-statue-mother-tara,06/01/2025
Divine Medicine Buddha Statue,MBBP 89,"$2,080.00","$2,600.00",Available,https://nidhiratna.com/products/divine-medicine-buddha-statue,06/01/2025
Chenrezig: The Embodiment of Compassion,CHA 87,"$2,476.00","$3,095.00",Available,https://nidhiratna.com/products/chenrezig-statue-buddhist-statue,06/01/2025
Namgyalma: The Goddess of Longevity and Purification,NGBP 108,$756.00,$945.00,Available,https://nidhiratna.com/products/namgyalma-the-goddess-of-longevity-and-purification,06/01/2025
Green Tara: The Swift Savior and Compassionate Mother,GTBP 109,,,Sold Out,https://nidhiratna.com/products/green-tara-the-swift-savior-and-compassionate-mother,06/01/2025
Maitreya Buddha: The Future Buddha,MBBP 121,"$1,040.00","$1,300.00",Available,https://nidhiratna.com/products/maitreya-buddha-the-future-buddha-statue,06/01/2025
The Sacred Deity Namgyalma,NGBP 122,"$1,444.00","$1,805.00",Available,https://nidhiratna.com/products/the-sacred-deity-namgyalma-statue,06/01/2025
Chenrezig: The Embodiment of Infinite Compassion,CHBP 111,,,Sold Out,https://nidhiratna.com/products/chenrezig-the-embodiment-of-infinite-statue,06/01/2025
"Vajrasattva: The Purifier of Body, Speech, and Mind",VSBP 112,"$2,796.00","$3,495.00",Available,https://nidhiratna.com/products/vajrasattva-the-purifier-of-body-speech-and-mind,06/01/2025
Manjushri: The Bodhisattva of Wisdom and Insight,MSBP 110,,,Sold Out,https://nidhiratna.com/products/manjushri-the-bodhisattva-of-wisddom-statue,06/01/2025
Amitayus: The Buddha of Infinite Life and Light,ATBP 113,,,Sold Out,https://nidhiratna.com/products/amitayus-the-buddha-of-infinite-life-statue,06/01/2025
Crowned Buddha Sakyamuni: The Regal Sage of Enlightenment,CBSBP 114,"$1,948.00","$2,435.00",Available,https://nidhiratna.com/products/crowned-buddha-sakyamuni-statue,06/01/2025
Chenrezig: The Embodiment of Compassion in Tibetan Buddhism,CHBP 115,"$2,328.00","$2,910.00",Available,https://nidhiratna.com/products/chenrezig-the-embodiment-of-compassion-statue,06/01/2025
Buddha Shakyamuni: Light of Liberation,BSBP 116,"$2,328.00","$2,910.00",Available,https://nidhiratna.com/products/buddha-shakyamuni-statue,06/01/2025
"Guru Rinpoche: The Second Buddha, Vajrayana Buddhism",GRBP 117,"$2,644.00","$3,305.00",Available,https://nidhiratna.com/products/guru-rinpoche-the-second-buddha-statue,06/01/2025
Buddha Shakyamuni: The Founder of Buddhism,BSBP 126,$784.00,$980.00,Available,https://nidhiratna.com/products/buddha-shakyamuni-gautama-buddha-statues,06/01/2025
Vajrasattva: Purification and Transformation,VSBP 127,"$1,108.00","$1,385.00",Available,https://nidhiratna.com/products/vajrasattva-purification-deity-statue,06/01/2025
White Tara: The Compassionate Mother,WTBP 128,$604.00,$755.00,Available,https://nidhiratna.com/products/white-tara-the-compassionate-mother,06/01/2025
Manjushri: The Radiant Sage of Enlightenment,MSBP 129,,,Sold Out,https://nidhiratna.com/products/manjushri-the-radiant-sage-of-enlightenment-statue,06/01/2025
Dzambhala: Bodhisattva of Wealth and Prosperity,DZBP 130,$588.00,$735.00,Available,https://nidhiratna.com/products/dzambhala-bodhisattva-of-wealth-statue,06/01/2025
Chenrezig: The Compassionate Bodhisattva,CHBP 131,$588.00,$735.00,Available,https://nidhiratna.com/products/chenrezig-the-compassionate-bodhisattva-statue,06/01/2025
Green Tara: The Ever-Compassionate Savior,GTBP 132,,,Sold Out,https://nidhiratna.com/products/green-tara-the-ever-compassionate-savior-statue,06/01/2025
Chenrezig: The Bodhisattva of Infinite Compassion,133 CHBP,,,Sold Out,https://nidhiratna.com/products/chenrezig-the-bodhisattva-of-compassion-statues-altars,06/01/2025
Green Tara: The Divine Mother of Liberation,GTBP 134,,,Sold Out,https://nidhiratna.com/products/green-tara-the-divine-mother-statue,06/01/2025
White Tara: Goddess of Peace and Healing,WTBP 135,$588.00,$735.00,Available,https://nidhiratna.com/products/white-tara-goddess-of-peace-statue,06/01/2025
Dzambhala: Guardian of Wealth and Fortune,DZBP 136,$756.00,$945.00,Available,https://nidhiratna.com/products/dzambhala-guardian-of-wealth-and-fortune-statue,06/01/2025
Six-Armed Mahakala: Guardian of Wisdom and Protector of Devotees,SAMBP 137,"$3,248.00","$4,060.00",Available,https://nidhiratna.com/products/six-armed-mahakala-guardian-of-wisdom-statue,06/01/2025
Dzambhala: The Wealth Bestower,DZBP 138,,,Sold Out,https://nidhiratna.com/products/dzambhala-the-wealth-bestower-statue,06/01/2025
Vajrasattva: Purification of the Mind,VSBP 139,"$1,276.00","$1,595.00",Available,https://nidhiratna.com/products/vajrasattva-purification-of-the-mind-statue,06/01/2025
Amitabha: The Buddha of Infinite Light,ABBP 141,$764.00,$955.00,Available,https://nidhiratna.com/products/amitabha-the-buddha-of-infinite-light-statue,06/01/2025
Amitayus: The Buddha of Eternal Life,ATBP 142,$672.00,$840.00,Available,https://nidhiratna.com/products/amitayus-the-buddha-of-eternal-life-statue,06/01/2025
Buddha Shakyamuni: The One Who Achieved Enlightenment,BSBP 123,"$1,788.00","$2,235.00",Available,https://nidhiratna.com/products/buddha-shakyamuni-statue-1,06/01/2025
Buddha Shakyamuni: The Enlightened One,BSBR 179,,,Sold Out,https://nidhiratna.com/products/buddha-shakyamuni-statue-gautama-buddha,06/01/2025
Radiant Serenity: The Golden Amitayus,ATBR 180,"$1,359.20","$1,699.00",Available,https://nidhiratna.com/products/radiant-serenity-the-golden-amitayus-statue,06/01/2025
Wisdom's Radiance: The Manjushri Statue,MSBR 181,"$1,359.20","$1,699.00",Available,https://nidhiratna.com/products/wisdoms-radiance-the-manjushri-statue,06/01/2025
Emerald Grace: The Statue of Green Tara,GTBR 182,"$1,359.20","$1,699.00",Available,https://nidhiratna.com/products/emerald-grace-the-green-tara-statue,06/01/2025
Golden Radiance: The Vajrasattva Statue,VSBR 183,"$1,359.20","$1,699.00",Available,https://nidhiratna.com/products/golden-radiance-the-vajrasattva-statue,06/01/2025
Eternal Essence: The Oxidized Copper Amitayus,ATBR 184,"$1,199.20","$1,499.00",Available,https://nidhiratna.com/products/eternal-essence-the-oxidized-copper-amitayus-statue,06/01/2025
Eternal Compassion: The Oxidized Copper Four-Armed Chenrezig,CHBR 185,"$1,199.20","$1,499.00",Available,https://nidhiratna.com/products/eternal-compassion-the-oxidized-copper-chenrezig,06/01/2025
Verdant Grace: The Oxidized Copper Green Tara,GTBR 186,"$1,199.20","$1,499.00",Available,https://nidhiratna.com/products/verdant-grace-the-oxidized-copper-green-tara,06/01/2025
Transcendent Patina: The Oxidized Copper Vajrasattva,VSBR 187,"$1,199.20","$1,499.00",Available,https://nidhiratna.com/products/transcendent-patina-the-oxidized-copper-statue,06/01/2025
"White Tara, the Goddess of Compassion and Healing",WTBR 188,"$1,199.20","$1,499.00",Available,https://nidhiratna.com/products/white-tara-the-goddess-of-compassion-and-healing,06/01/2025
Radiant Vajrasattva Statue,VSBR 189,"$1,359.20","$1,699.00",Available,https://nidhiratna.com/products/radiant-vajrasattva-statue,06/01/2025
White Tara: The Mother of Liberation,WTBR 190,"$1,359.20","$1,699.00",Available,https://nidhiratna.com/products/white-tara-the-mother-of-liberation-statue,06/01/2025
Green Tara: Guardian of Compassion,GTBR 191,"$1,359.20","$1,699.00",Available,https://nidhiratna.com/products/green-tara-guardian-of-compassion-statue,06/01/2025
Illuminated Manjushri Statue,MSBR 192,"$1,359.20","$1,699.00",Available,https://nidhiratna.com/products/lluminated-manjushri-statue,06/01/2025
Guru Rinpoche Statue: Icon of Enlightened Compassion,GRBR 193,"$1,296.00","$1,620.00",Available,https://nidhiratna.com/products/guru-rinpoche-statue-icon-of-enlightened-compassion,06/01/2025
Enchanting Kurukulla Statue,KKBR 194,"$1,016.00","$1,270.00",Available,https://nidhiratna.com/products/enchanting-kurukulla-statue,06/01/2025
Majestic Mahakala Bernagchen Statue,MBBR 195,$844.00,"$1,055.00",Available,https://nidhiratna.com/products/majestic-mahakala-bernagchen-statue,06/01/2025
Magnificent Singha Mukha Statue,SMBR 196,"$1,016.00","$1,270.00",Available,https://nidhiratna.com/products/magnificent-singha-mukha-statue,06/01/2025
The Timeless Beauty of the Oxidized Green Tara Statue,GTBR 197,$844.00,"$1,055.00",Available,https://nidhiratna.com/products/the-timeless-beauty-of-the-oxidized-green-tara-statue,06/01/2025
Exquisite Chenrezig Statue,CHBR 198,$844.00,"$1,055.00",Available,https://nidhiratna.com/products/exquisite-chenrezig-statue,06/01/2025
Crafting Serenity: The Green Tara Statue,GTBR 199,"$2,664.00","$3,330.00",Available,https://nidhiratna.com/products/crafting-serenity-the-green-tara-statue,06/01/2025
Chenrezig: The Bodhisattva of Boundless Compassion,CHBP 143,,,Sold Out,https://nidhiratna.com/products/chenrezig-the-bodhisattva-statue,06/01/2025
Green Tara: The Compassionate Savior,GTBP 144,,,Sold Out,https://nidhiratna.com/products/green-tara-the-compassionate-savior-statue,06/01/2025
